Main Category,Sub-Category,url,image,name,description,ingredients,steps,nutrients,times
Desserts,Healthy dessert recipes,https://www.bbcgoodfood.com/recipes/lemon-violet-drizzle-cake,assets/img/253.jpg,Lemon & violet drizzle cake,A simple and sweet all-in-one cake - ideal for Mothering Sunday,"['100g softened butter', '175g self-raising flour', '1 tsp baking powder', '175g golden caster sugar', '2 large eggs', '6 tbsp milk', 'finely grated rind of 1 large lemon', 'juice of 1 large lemon (you need 3 tablespoons)', '100g golden caster sugar', 'mimosa balls and crystallised violets, to decorate']","['Preheat the oven to 180C/Gas 4/fan oven 160C. Butter and line the base of a shallow oblong tin (about 18x28cm/7x11in) with baking parchment. Tip all the cake ingredients into a large mixing bowl and beat for 2-3 minutes, until the mixture drops easily off the spoon.', 'Spoon the mixture into the tin and smooth the surface with the back of a spoon. Bake for 30-40 minutes, until golden and firm to the touch. Meanwhile, make the icing: beat together the lemon juice and sugar, pour the mixture evenly over the cake while it is still hot, then leave to cool.', 'Cut the cake into 15 squares. Top each one with a crystallised violet and mimosa ball.']","{'kcal': 175.0, 'fat': 7.0, 'saturates': 4.0, 'carbs': 29.0, 'sugars': 19.0, 'fibre': 0.0, 'protein': 2.0, 'salt': 0.3}",60
Desserts,Healthy dessert recipes,https://www.bbcgoodfood.com/recipes/apricot-raspberry-tart,assets/img/254.jpg,Apricot & raspberry tart,"Delicious served hot or cold, this tart uses filo pastry to keep the calories down","['3 large sheets filo pastry (or 6 small)', '2 tbsp butter, melted', '3 tbsp apricot conserve', '6 ripe apricots, stoned and roughly sliced', '85g raspberries', '2 tsp caster sugar']","['Let the filo come to room temperature for about 10 mins before use. Put a baking tray into the oven and heat oven to 200C/180C fan/gas 6.', 'Brush each large sheet of filo with melted butter, layer on top of each other, then fold in half so you have a smaller rectangle 6 layers thick. If using small sheets just stack on top of each other. Fold in the edges of the pastry base to make a 2cm border, then spread the apricot conserve inside the border. Carefully slide the pastry base on to the hot baking tray and bake for 5 mins.', 'Remove from oven, arrange apricots over the tart and brush with any leftover melted butter. Bake for another 10 mins, then scatter on raspberries and sprinkle with sugar. Bake for a final 10 mins until the pastry is golden brown and crisp.']","{'kcal': 150.0, 'fat': 7.0, 'saturates': 4.0, 'carbs': 22.0, 'sugars': 18.0, 'fibre': 2.0, 'protein': 2.0, 'salt': 0.33}",40
Desserts,Healthy dessert recipes,https://www.bbcgoodfood.com/recipes/healthy-apple-crunch,assets/img/255.jpg,Healthy apple crunch,"Try our healthy, sugar-free twist on apple crumble for dessert – the soya yogurt base is topped with stewed apples and crunchy cinnamon-oat clusters","['240g Bramley cooking apples, peeled, cored and chopped (200g prepared weight)', '3-4 small dessert apples, peeled, cored and sliced (260g prepared weight)', '340g porridge oats', '2 tbsp ground cinnamon', '2 tsp vanilla extract', '3 tbsp rapeseed oil', '400g fortified soya yogurt']","['Heat the oven to 180C/160C fan/gas 4. Tip all the apples into a small pan with 6 tbsp water, then cover and cook over a medium heat for 6 mins, stirring halfway through, until the apples are just cooked. The cooking apples should be pulpy, but the dessert apples will retain their shape.', 'Tip the oats, cinnamon and vanilla into a bowl and add 3 tbsp of the apple mixture, the oil and 100g of the yogurt. Mix everything together well using your hands, until the mixture has formed into chunky clusters similar to granola. Spread the clusters out over a large baking sheet lined with baking parchment, and bake for 10 mins. Shake the tray to turn the clusters over and bake for 10 mins more until firm. Leave to cool for 5 mins so the clusters can firm up slightly more.', 'Meanwhile, spoon the remaining yogurt into a small, shallow ovenproof dish, then spoon the rest of the apples on top. Scatter over the oat clusters, and bake for 10 mins until the topping is firm and golden and the apple mixture has warmed through.This recipe is part of our free 7-day healthy diet plan. To access the full meal plan, click here.']","{'kcal': 552.0, 'fat': 19.0, 'saturates': 2.0, 'carbs': 71.0, 'sugars': 14.0, 'fibre': 12.0, 'protein': 17.0, 'salt': 0.37}",65
Desserts,Healthy dessert recipes,https://www.bbcgoodfood.com/recipes/instant-frozen-berry-yogurt,assets/img/256.jpg,Instant frozen berry yogurt,"Three ingredients and two minutes is all you need to whip up this low-fat, low-calorie frozen yogurt treat, which is ideal for eating after exercise or as a quick dessert","['250g frozen mixed berry', '250g 0%-fat Greek yogurt', '1 tbsp honey or agave syrup']","['Blend berries, yogurt and honey or agave syrup in a food processor for 20 seconds, until it comes together to a smooth ice-cream texture. Scoop into bowls and serve.']","{'kcal': 71.0, 'fat': 0.2, 'saturates': 0.1, 'carbs': 9.0, 'sugars': 9.0, 'fibre': 2.0, 'protein': 7.0, 'salt': 0.1}",2
Desserts,Healthy dessert recipes,https://www.bbcgoodfood.com/recipes/slow-cooker-rice-pudding,assets/img/257.jpg,Slow cooker rice pudding,"Enjoy a nostalgic pudding, or a gluten-free alternative to porridge for breakfast. Add natural sweetness with fruit or almonds and a dusting of cinnamon","['1 tsp butter', '1l semi-skimmed milk', '200g wholegrain rice', 'nutmeg or cinnamon', '1 tbsp honey, a handful toasted, flaked almonds and fruit, to serve']","['Butter the slow cooker all over the base and half way up the sides. Heat the milk to simmering point. Mix the pudding rice with the milk and pour it into the slow cooker. Add a grating of nutmeg or cinnamon. Cook for 2½ hours on High and stir once or twice if you can.', 'Serve with honey, or flaked almonds and fruit if you like.']","{'kcal': 200.0, 'fat': 4.0, 'saturates': 2.0, 'carbs': 32.0, 'sugars': 8.0, 'fibre': 1.0, 'protein': 8.0, 'salt': 0.2}",17
Desserts,Healthy dessert recipes,https://www.bbcgoodfood.com/recipes/ultimate-makeover-chocolate-mousse,assets/img/258.jpg,The ultimate makeover: Chocolate mousse,"This sophisticated dessert is great for a dinner party, or for a lighter family pud use ordinary dark chocolate with less cocoa solids","[""85g dark chocolate, 70% (I used Green & Black's)"", '1 tbsp cocoa powder, plus extra for dusting', '½ tsp coffee granules', '½ tsp vanilla extract', '2 egg whites', '1 tbsp golden caster sugar', '50g full-fat Greek yogurt', 'handful raspberries, to decorate']","['Chop the chocolate very finely and put it into a large bowl that will fit over a pan of simmering water. Mix the cocoa, coffee and vanilla with 2 tbsp cold water, and pour over the chocolate. Place the bowl over the gently simmering water, give it all a stir, then remove from the heat. Leave with the bowl of chocolate still over the water, stirring occasionally to check when melted.', 'Stir the melted chocolate, it will be quite thick. Stir in 2 tbsp boiling water and the chocolate will immediately thin down and become silky smooth. Leave to cool slightly.', 'Whisk the egg whites to fairly soft peaks, then whisk in the sugar until thick and glossy. Beat the yogurt into the cooled chocolate. Fold about one-third of the egg whites into the chocolate mix using a large metal spoon, then very gently fold in the rest of the whites until they are evenly mixed in – being careful not to over-mix or you will lose the volume of the mousse. Spoon into 4 small cups or (125-150ml) ramekins and chill for a couple of hours, or overnight.', 'Place each mousse on a saucer or small plate. Top with a few raspberries, then dust with a little cocoa powder. Will keep for up to 2 days in the fridge.']","{'kcal': 167.0, 'fat': 10.0, 'saturates': 5.0, 'carbs': 15.0, 'sugars': 11.0, 'fibre': 2.0, 'protein': 4.0, 'salt': 0.12}",20
Desserts,Healthy dessert recipes,https://www.bbcgoodfood.com/recipes/juicy-lucy-pudding,assets/img/259.jpg,Juicy Lucy pudding,Look no further for a fruity dessert that's both delicious and nourishing,"['350g packet   frozen fruits of the forest, defrosted', '3 tbsp light muscovado sugar', '4 tbsp no-added-sugar wild  blueberry  jam (we used St Dalfour, from larger supermarket branches)', '6 medium-sized ripe pears, peeled, quartered and cored', '50g fresh white breadcrumb', '25g butter, melted']","['Preheat the oven to 190C/gas 5/ fan 170C. Mix the fruits of the forest in a large bowl with the sugar and jam, then add the pears and toss to mix. Tip into a deep baking dish measuring about 18x28cm, cover with foil and roast in the oven for 20 minutes. Pierce a pear or two to see if they are really tender; if not, return dish to the oven for another 5 minutes or until they feel soft.', 'Mix breadcrumbs with the butter and scatter over the fruit. Bake uncovered in the oven for 10-15 minutes or until golden and crispy. Serve hot.']","{'kcal': 276.0, 'fat': 6.0, 'saturates': 3.0, 'carbs': 56.0, 'sugars': 16.0, 'fibre': 7.0, 'protein': 3.0, 'salt': 0.14}",50
Desserts,Healthy dessert recipes,https://www.bbcgoodfood.com/recipes/spiced-roasted-apples-blackberries,assets/img/260.jpg,Spiced roasted apples & blackberries,"This guilt-free pudding tastes wonderful served with low-fat fromage frais, mixed with a little honey","['4medium Bramley apples, each weighing about 200g/8oz', '4 tbsp clear honey', '½ tsp ground cinnamon', 'finely grated zest and juice of 1 large orange', '250g blackberry']","['Preheat the oven to 180C/gas 4/fan 160C. Core the apples so you have a hole the size of a pound coin in each one. Make a cut just into the skin around the middle of each apple.', 'Stand the apples in a shallow baking dish large enough to take all four. Mix together the honey, cinnamon and orange zest, put an equal amount into the cavity of each apple, then pour the orange juice into the dish.', 'Roast the apples for about 40 minutes, spooning the juices over them occasionally. Then, when the apples are almost ready, spoon the blackberries around and over the top of each apple. Return to the oven for 10 minutes or until the juices start to run. Spoon the blackberries and juices over the apples to serve.']","{'kcal': 129.0, 'fat': 0.3, 'saturates': 0.0, 'carbs': 32.0, 'sugars': 15.0, 'fibre': 5.0, 'protein': 1.0, 'salt': 0.0}",60
Desserts,Healthy dessert recipes,https://www.bbcgoodfood.com/recipes/ultimate-makeover-lemon-tart,assets/img/261.jpg,The ultimate makeover: Lemon tart,"Enjoy an incredible half-fat version of this classic dessert, which tastes every bit as good as the original","['50g butter, cut in pieces', '140g plain flour', '1 tbsp icing sugar', '1 tbsp extra virgin rapeseed oil', '1 medium egg yolk', '3 medium eggs, plus 2 medium egg whites', '140g icing sugar, plus extra for dusting', '2 tbsp finely grated lemon zest (about 4 lemons)', '125ml lemon juice (from 4-5 lemons)', '200ml tub half-fat crème fraîche']","['Rub the butter into the flour until the mix looks like fine breadcrumbs. Stir in the icing sugar, then make a well and use a round-bladed knife to stir in the oil, egg yolk and 1½-2 tbsp cold water until dough comes together. Without overhandling, gather into a ball. On a lightly floured surface, roll out so it fits a 23 x 2cm loose-bottom flan tin. Ease the pastry into the tin, then trim the edges by rolling the rolling pin over the top. Press the pastry into the flutes so it sits very slightly proud of the edge (this extra height helps in case of any shrinkage). Lightly prick the pastry base with a fork, then chill for about 10 mins. Heat the oven to 190C/170C fan/gas 5.', 'Meanwhile, make the filling. Beat the eggs and egg whites together with a wooden spoon until well mixed. Sift the icing sugar into a bowl, then gradually beat in the eggs. If the mix is at all lumpy, simply beat with a wire whisk. Stir in the lemon zest and the juice. Leave to stand so the lemon flavour can develop.', 'Sit the chilled pastry case on a baking sheet. Line with baking parchment and baking beans and bake blind for 20 mins until well set. Carefully lift out the beans and paper, then bake the pastry case for another 3-5 mins until the base is cooked and pale golden.', 'Strain the lemon mixture through a sieve. Beat the crème fraîche in a medium bowl until smooth, then slowly stir in the lemon mix until well blended. Transfer to a jug, then carefully pour two thirds into the warm pastry case. Place in the oven with the oven shelf half out, pour in the rest of the filling, then carefully slide the shelf back in. Reduce the heat to 150C/130C fan/gas 2. Bake for 25-30 mins until barely set with a slight wobble in the middle. Cool for about 1 hr, then serve with a light dusting of icing sugar. Best eaten the same day.']","{'kcal': 186.0, 'fat': 9.0, 'saturates': 4.0, 'carbs': 24.0, 'sugars': 15.0, 'fibre': 0.0, 'protein': 4.0, 'salt': 0.14}",90
Desserts,Healthy dessert recipes,https://www.bbcgoodfood.com/recipes/fromage-frais-mousse-strawberry-sauce,assets/img/262.jpg,Fromage frais mousse with strawberry sauce,"This low-fat dessert has a wonderfully light and airy texture, and it's suitable for vegetarians too","['1 large egg white', '50g icing sugar, plus 2 tbsp', 'grated zest 1 lemon and juice of ½', '500g tub low-fat fromage frais', '500g strawberries']","['Put the egg white into a heatproof bowl with the icing sugar. Set the bowl over a large pan of simmering water and, using a hand electric whisk, whisk for 5 mins until the mixture is light, fluffy and holds peaks when the blades are lifted. Remove from heat, whisk in the lemon zest, then whisk for a further 2 mins to cool it down.', 'Fold in the fromage frais, then transfer to six glasses or small bowls and chill. Roughly chop half the strawberries and put in the food processor with the 2 tbsp icing sugar and the lemon juice. Whizz to a purée, then press through a sieve to remove the seeds. Chop the remaining strawberries.', 'Spoon the chopped strawberries over the mousses, then spoon a little purée over each. Chill until ready to serve.']","{'kcal': 118.0, 'fat': 0.0, 'saturates': 0.0, 'carbs': 23.0, 'sugars': 23.0, 'fibre': 1.0, 'protein': 8.0, 'salt': 0.13}",25
Desserts,Healthy dessert recipes,https://www.bbcgoodfood.com/recipes/pineapple-pink-grapefruit-mint-sugar,assets/img/263.jpg,Pineapple & pink grapefruit with mint sugar,A healthy and satisfying pudding that is refreshing and sweet,"['1 medium pineapple', '2 pink grapefruit', '50g golden granulated sugar', 'small bunch mint, leaves only']","['Use a sharp knife to top and tail the pineapple, then stand it upright on a chopping board. With the sharp knife, carve the skin away and discard. Rest the pineapple on its side, then cut into wafer-thin slices. Repeat with the grapefruit, cutting away the peel and pith, then cut into slices. Arrange the fruit on a serving platter, catching any juices, and set aside.', 'Using a pestle and mortar, pound the sugar and mint together until completely blended. Scatter the mint sugar over the fruit and serve with yogurt.']","{'kcal': 168.0, 'fat': 1.0, 'saturates': 0.0, 'carbs': 42.0, 'sugars': 41.0, 'fibre': 4.0, 'protein': 2.0, 'salt': 0.02}",10
Desserts,Healthy dessert recipes,https://www.bbcgoodfood.com/recipes/ultimate-makeover-vanilla-ice-cream,assets/img/264.jpg,The ultimate makeover: Vanilla ice cream,"Angela Nilsen creates a luscious ice cream that is creamy, fresh and - wait for it.... low-fat! ","['85g golden granulated sugar  or caster', '1 ½ tsp custard  powder', '1 ½ tsp cornflour', '500ml full-fat milk', '2 egg yolks', '1 vanilla pod, split in half lengthways', '200ml carton half-fat crème fraîche', 'lightly crushed raspberries  or strawberries, to serve']","['Freeze the canister from the ice-cream machine a day before you make the ice cream (if your machine requires you to). Next day, mix the sugar, custard powder and cornflour with 2 tbsp milk to make a thin paste. Beat in egg yolks. Pour the rest of the milk into a pan, scrape in the vanilla seeds, add the pod, then bring to the boil. Pour this slowly over the cornflour mix, stirring all the time as you do so. Clean the pan, then pour the milk mixture and vanilla pod back into it. Cook over a medium heat, stirring all the time, until it just comes to the boil and is thick enough to coat the back of a spoon.', 'Remove from the heat, stir in the crème fraîche, then pour into a bowl. Place a piece of greaseproof paper over the surface to prevent a skin forming, then leave to cool. Put into the fridge until really cold for at least 4-5 hrs (preferably overnight).', 'Remove the paper and vanilla pod from the custard, then transfer the custard into a jug. Turn on the ice cream machine, then slowly pour in the custard. Leave to churn for 10-30 mins (depending on your machine). When it stops, spoon into a plastic container, cover with cling film and a lid, then freeze for at least 3-4 hrs. (Will keep for up to 1 month. Do not re-freeze.) For the best taste, remove from the freezer and soften in the fridge for 1-1½ hrs before serving. Serve with fresh fruit.']","{'kcal': 148.0, 'fat': 8.0, 'saturates': 4.0, 'carbs': 17.0, 'sugars': 15.0, 'fibre': 0.0, 'protein': 4.0, 'salt': 0.11}",20
Desserts,Healthy dessert recipes,https://www.bbcgoodfood.com/recipes/sticky-cinnamon-figs,assets/img/265.jpg,Sticky cinnamon figs,A simple and stylish nutty fig pudding ready in just 10 minutes,"['8  ripe figs', 'large  knob of butter', '4 tbsp clear honey', 'handful  shelled pistachio  nuts or almonds', '1 tsp  ground cinnamon  or mixed spice', 'mascarpone  or Greek yogurt, to serve']","['Heat grill to medium high. Cut a deep cross in the top of each fig then ease the top apart like a flower. Sit the figs in a baking dish and drop a small piece of the butter into the centre of each fruit. Drizzle the honey over the figs, then sprinkle with the nuts and spice.', 'Grill for 5 mins until figs are softened and the honey and butter make a sticky sauce in the bottom of the dish. Serve warm, with dollops of mascarpone or yogurt.']","{'kcal': 162.0, 'fat': 7.0, 'saturates': 2.0, 'carbs': 23.0, 'sugars': 11.5, 'fibre': 2.0, 'protein': 3.0, 'salt': 0.06}",10
Desserts,Healthy dessert recipes,https://www.bbcgoodfood.com/recipes/effortless-raspberry-iced-mousse,assets/img/266.jpg,Effortless raspberry iced mousse,Use raspberries straight from the freezer for a mousse that will unfreeze your tastebuds,"['2 x 250g tubs quark  (low-fat cream cheese)', '50g icing sugar', 'squeeze or two of lemon juice', '250g pack of frozen raspberries']","['Tip the quark and sugar into a large bowl, squeeze in a few drops of lemon juice and beat with a wooden spoon until smooth and creamy (you can do this an hour or two ahead).', 'Gently stir in raspberries until they begin to break up and mixture is streaked pink; taste and add a little more lemon juice if liked. Spoon into glasses and serve.']","{'kcal': 158.0, 'fat': 0.0, 'saturates': 0.0, 'carbs': 21.0, 'sugars': 13.0, 'fibre': 2.0, 'protein': 19.0, 'salt': 0.17}",5
Desserts,Healthy dessert recipes,https://www.bbcgoodfood.com/recipes/honeyed-orange-grapefruit,assets/img/267.jpg,Honeyed orange & grapefruit,"Simple and healthy, this makes a lovely light dessert on its own or with pastries for a real treat","['3 oranges', '1 pink grapefruit or pomello', '1 red grapefruit', '2 tbsp clear honey', '1-2 tbsp orange blossom water']","[""Top and tail all the oranges and grapefruits. One at a time, sit each on a board and using a small, sharp serrated knife slice away the peel and pith. Thinly slice into rounds. Arrange on a platter, drizzle over honey and orange blossom water, and set aside at room temperature, loosely covered with cling film until ready to serve. Serve with the pastries and orange cream (see 'Goes well with').""]","{'kcal': 66.0, 'fat': 0.0, 'saturates': 0.0, 'carbs': 16.0, 'sugars': 16.0, 'fibre': 2.0, 'protein': 2.0, 'salt': 0.02}",10
Desserts,Healthy dessert recipes,https://www.bbcgoodfood.com/recipes/sweet-fruity-yorkshire-pudding,assets/img/268.jpg,Sweet & fruity Yorkshire pudding,"Not just an accompaniment to your Sunday dinner, you can also use Yorkshire pudding as a base for a delicious dessert. We love this fruity version","['2 x 400g cans  fruit  in juice, drained', '130g pack Yorkshire pudding batter mix (or see our recipe in the tip box, below)', '50g caster sugar', 'icing  sugar to dust, optional']","['Heat oven to 220C/fan 200C/gas 7. Spread the fruit out in a medium baking dish. Make the batter according to pack instructions and add the caster sugar.', 'Pour the batter over the fruit and bake for 20-25 mins until golden and set. Dust with icing sugar, if you like, and serve hot or warm.']","{'kcal': 363.0, 'fat': 7.0, 'saturates': 2.0, 'carbs': 69.0, 'sugars': 53.0, 'fibre': 2.0, 'protein': 11.0, 'salt': 0.26}",30
Desserts,Apple dessert recipes,https://www.bbcgoodfood.com/recipes/ultimate-apple-pie,assets/img/269.jpg,Homemade apple pie,Try our classic Bramley apple pie with homemade shortcrust pastry. Simplicity is key to this traditional dish which makes for a comforting family pudding.,"['1kg Bramley apples', '140g golden caster sugar', '½ tsp cinnamon', '3 tbsp flour', '225g butter, room temperature', '50g golden caster sugar, plus extra', '2 eggs', '350g plain flour, preferably organic', 'softly whipped cream, to serve']","['Put a layer of paper towels on a large baking sheet. Quarter, core, peel and slice the apples about 5mm thick and lay evenly on the baking sheet. Put paper towels on top and set aside while you make and chill the pastry.', 'For the pastry, beat the butter and sugar in a large bowl until just mixed. Break in a whole egg and a yolk (keep the white for glazing later). Beat together for just under 1 min – it will look a bit like scrambled egg. Now work in the flour with a wooden spoon, a third at a time, until it’s beginning to clump up, then finish gathering it together with your hands. Gently work the dough into a ball, wrap in cling film, and chill for 45 mins. Now mix the 140g/5oz sugar, the cinnamon and flour for the filling in a bowl that is large enough to take the apples later.', 'After the pastry has chilled, heat the oven to 190C/fan 170C/gas 5. Lightly beat the egg white with a fork. Cut off a third of the pastry and keep it wrapped while you roll out the rest, and use this to line a pie tin – 20-22cm round and 4cm deep – leaving a slight overhang. Roll the remaining third to a circle about 28cm in diameter. Pat the apples dry with kitchen paper, and tip them into the bowl with the cinnamon-sugar mix. Give a quick mix with your hands and immediately pile high into the pastry-lined tin.', 'Brush a little water around the pastry rim and lay the pastry lid over the apples pressing the edges together to seal. Trim the edge with a sharp knife and make 5 little slashes on top of the lid for the steam to escape. (Can be frozen at this stage.) Brush it all with the egg white and sprinkle with caster sugar. Bake for 40-45 mins, until golden, then remove and let it sit for 5-10 mins. Sprinkle with more sugar and serve while still warm from the oven with softly whipped cream.']","{'kcal': 695.0, 'fat': 33.0, 'saturates': 20.0, 'carbs': 95.0, 'sugars': 32.0, 'fibre': 4.0, 'protein': 9.0, 'salt': 0.79}",2
Desserts,Apple dessert recipes,https://www.bbcgoodfood.com/recipes/somerset-pomona-apple-almond-cake,assets/img/270.jpg,"Somerset Pomona, apple & almond cake",This simple cake makes a great dinner treat or serve with cream for a filling dessert,"['4medium dessert  apples', 'knob of butter, plus extra for greasing', '200g butter, softened', '200g golden caster sugar', '3large eggs, beaten', '140g self-raising flour', '50g ground almond', '2 tbsp Somerset Pomona, plus extra to drizzle', '2 tbsp apricot jam', '1 tbsp Somerset Pomona']","['Heat oven to 180C/fan 160C/gas 4. Butter and line the base and sides of a 20cm round cake tin. Peel, core and slice the apples to about the thickness of a £1 coin. Melt the knob of butter in a large frying pan then tip in the apples. Cook over a medium heat, stirring every so often till softened, but not soggy, about 5 mins. Splash in the Pomona and leave to cool. Tip onto a plate to cool more quickly if you like.', 'Using an electric whisk or wooden spoon, beat the softened butter and sugar until creamy and light. Add the eggs a little at a time, beating after each addition, then fold in the flour and almonds. Finally, fold in half of the cooled apples. Spoon the mix into the prepared tin, smooth the top and scatter with the rest of the apples, pressing down lightly into the batter.', 'Bake for 1 hr, until golden and a skewer inserted into the middle of the cake comes out clean. Check the cake after 45 mins, cover with foil if it’s browning too quickly. To make the glaze, warm the jam and Pomona in a small pan until the jam melts.', 'Once the cake is out of the oven, prick it all over with a skewer and drizzle over a little more Pomona. Cool for 10 mins, then turn out of the tin and transfer to a wire rack. Brush the glaze over the apples and serve sliced, with dollops of Pomona cream. Best eaten on the day it’s made, or warmed through the next.']","{'kcal': 388.0, 'fat': 22.0, 'saturates': 12.0, 'carbs': 42.0, 'sugars': 31.0, 'fibre': 2.0, 'protein': 5.0, 'salt': 0.52}",26
