Main Category,Sub-Category,url,image,name,description,ingredients,steps,nutrients,times
Lunch recipes,Quick lunch recipes,https://www.bbcgoodfood.com/recipes/smoked-salmon-quinoa-dill-lunch-pot,assets/img/0.jpg,"Smoked salmon, quinoa & dill lunch pot","This easy packed lunch is as delicious as it is nutritious, with crunchy cucumber and radishes and a herby, creamy dressing","['2 tbsp half-fat soured cream', '2 tbsp lemon juice', '½ pack dill, finely chopped', '250g pouch ready-to-eat quinoa (we used Merchant Gourmet)', '½ cucumber, halved and sliced', '4 radishes, finely sliced', '100g smoked salmon, torn into strips']","['First, make the dressing. Mix the soured cream and lemon juice together in a bowl, then add most of the dill, reserving a quarter for serving.', 'In another bowl, combine the quinoa with the cucumber and radishes, and stir through half the dressing. Season and top with the salmon and the rest of the dill.', 'Put the other half of the dressing in a small pot and drizzle over the quinoa just before serving.']","{'kcal': 254.0, 'fat': 7.0, 'saturates': 2.0, 'carbs': 26.0, 'sugars': 3.0, 'fibre': 5.0, 'protein': 20.0, 'salt': 2.5}",15
Lunch recipes,Quick lunch recipes,https://www.bbcgoodfood.com/recipes/bulgur-quinoa-lunch-bowls,assets/img/1.jpg,Bulgur & quinoa lunch bowls,"These meal prep grain bowls use one base and two deliciously different toppings. Choose from avocado, olives and rocket or chickpeas, beetroot and orange","['1 large onion, very finely chopped', '150g bulgur and quinoa (this comes ready mixed)', '2sprigs of  thyme', '2 tsp vegetable bouillon powder', '1 avocado, halved, destoned and chopped', '2 tomatoes, cut into wedges', '4 tbsp chopped basil', '6 Kalamata olives, halved', '2 tsp extra virgin olive oil', '2 tsp cider vinegar', '2 big handfuls of rocket', '210g can chickpeas, drained', '160g cooked beetroot, diced', '2 tomatoes, cut into wedges', '2 tbsp chopped mint', '1 tsp cumin seeds', 'several pinches of ground cinnamon', '2 tsp extra virgin olive oil', '2 tsp cider vinegar', '1 orange, cut into segments', '2 tbsp toasted pine nuts']","['Tip the onion and bulgur mix into a pan, pour over 600ml water and stir in the thyme and bouillon. Cook, covered, over a low heat for 15 mins, then leave to stand for 10 mins. All the liquid should now be absorbed. When cool, remove the thyme and divide the bulgur between four bowls or plastic containers.', 'For the avocado topping, toss all the ingredients together except for the rocket. Pile onto two portions of the bulgur and top with the rocket.', 'For the beetroot topping, first pile the chickpeas on top, then toss the beetroot with the tomato, mint, cumin, a good pinch of cinnamon, the oil and vinegar. Toss well, add the orange, then pile onto the remaining portions of bulghur, scatter with the pine nuts and sprinkle with extra cinnamon. Chill in the fridge until needed.']","{'kcal': 369.0, 'fat': 20.0, 'saturates': 4.0, 'carbs': 33.0, 'sugars': 8.0, 'fibre': 10.0, 'protein': 8.0, 'salt': 0.5}",20
Lunch recipes,Quick lunch recipes,https://www.bbcgoodfood.com/recipes/falafel-burgers-0,assets/img/2.jpg,Falafel burgers,A healthy burger that's filling too. These are great for anyone after a satisfying bite low in calories.,"['400g can  chickpeas, rinsed and drained', '1 small red onion, roughly chopped', '1 garlic clove, chopped ', 'handful of flat-leaf parsley  or curly parsley', '1 tsp ground cumin', '1 tsp ground coriander', '½ tsp harissa paste  or chilli powder', '2 tbsp plain flour', '2 tbsp sunflower oil', 'toasted pitta bread, to serve', '200g tub tomato salsa, to serve', 'green salad, to serve']","['Drain the chickpeas and pat dry with kitchen paper. Tip into a food processor along with the onion, garlic, parsley, cumin, coriander, harissa paste, flour and a little salt. Blend until fairly smooth, then shape into four patties with your hands.', 'Heat the sunflower oil in a non-stick frying pan, and fry the burgers for 3 mins on each side until lightly golden. Serve with the toasted pitta bread, tomato salsa and green salad.']","{'kcal': 161.0, 'fat': 8.0, 'saturates': 1.0, 'carbs': 18.0, 'sugars': 1.0, 'fibre': 3.0, 'protein': 6.0, 'salt': 0.4}",16
Lunch recipes,Quick lunch recipes,https://www.bbcgoodfood.com/recipes/spicy-chicken-avocado-wraps,assets/img/3.jpg,Spicy chicken & avocado wraps,"Pan-fry lean chicken breast with lime, chilli and garlic, then pile onto seeded tortilla wraps. Cool before assembling if packing for lunch","['1 chicken breast (approx 180g), thinly sliced at an angle', 'generous squeeze juice 0.5 lime', '½ tsp mild chilli powder', '1 garlic clove, chopped', '1 tsp olive oil', '2 seeded wraps', '1 avocado, halved and stoned', '1 roasted red pepper from a jar, sliced', 'a few sprigs coriander, chopped']","['Mix the chicken with the lime juice, chilli powder and garlic.', 'Heat the oil in a non-stick frying pan then fry the chicken for a couple of mins – it will cook very quickly so keep an eye on it. Meanwhile, warm the wraps following the pack instructions or, if you have a gas hob, heat them over the flame to slightly char them. Do not let them dry out or they are difficult to roll.', 'Squash half an avocado onto each wrap, add the peppers to the pan to warm them through then pile onto the wraps with the chicken, and sprinkle over the coriander. Roll up, cut in half and eat with your fingers.']","{'kcal': 403.0, 'fat': 16.0, 'saturates': 4.0, 'carbs': 32.0, 'sugars': 2.0, 'fibre': 5.0, 'protein': 29.0, 'salt': 0.8}",13
Lunch recipes,Quick lunch recipes,https://www.bbcgoodfood.com/recipes/prawn-mango-salad,assets/img/4.jpg,Prawn & mango salad,Kids will love this colourful salad with avocado and mint - add cold cooked pasta for a more filling packed lunch,"['½ avocado, peeled and cut into cubes, see tip, below left', 'squeeze of lemon juice', '50g small cooked prawns', '1 mango cheek, peeled and cut into cubes', '4 cherry tomatoes, halved', 'finger-sized piece cucumber, chopped', 'handful baby spinach leaves', 'couple of mint leaves, very finely shredded', '1-2 tsp sweet chilli sauce']","['Mix the avocado with the lemon juice, then toss with the prawns, mango, tomatoes, cucumber, spinach and mint. Pack into a lunchbox and drizzle over the sweet chilli sauce, then chill until ready to eat.']","{'kcal': 168.0, 'fat': 9.0, 'saturates': 2.0, 'carbs': 15.0, 'sugars': 14.0, 'fibre': 4.0, 'protein': 6.0, 'salt': 0.5}",10
Lunch recipes,Quick lunch recipes,https://www.bbcgoodfood.com/recipes/egg-rocket-pizzas,assets/img/5.jpg,Egg & rocket pizzas,Use seeded tortillas as pizza bases for a quick and healthy lunch - crack an egg in the centre and bake to boost protein intake,"['2 seeded wraps', 'a little olive oil, for brushing', '1 roasted red pepper, from a jar', '2 tomatoes', '2 tbsp tomato purée', '1 tbsp chopped dill', '2 tbsp chopped parsley', '2 eggs', '65g pack  rocket', '½ red onion, very thinly sliced ']","['Heat oven to 200C/180C fan/gas 6. Lay the tortillas on two baking sheets, brush sparingly with the oil then bake for 3 mins. Meanwhile chop the pepper and tomatoes and mix with the tomato purée, seasoning and herbs. Turn the tortillas over and spread with the tomato mixture, leaving the centre free from any large pieces of pepper or tomato.', 'Break an egg into the centre then return to the oven for 10 mins or until the egg is just set and the tortilla is crispy round the edges. Serve scattered with the rocket and onion.']","{'kcal': 327.0, 'fat': 11.0, 'saturates': 3.0, 'carbs': 39.0, 'sugars': 8.0, 'fibre': 5.0, 'protein': 15.0, 'salt': 1.0}",30
Lunch recipes,Quick lunch recipes,https://www.bbcgoodfood.com/recipes/orecchiette-with-butter-beans-parsley-chilli-lemon,assets/img/6.jpg,"Orecchiette with butter beans, parsley, chilli & lemon","Make this simple pasta dish using whatever you’ve got to hand, including different pasta shapes, beans or chopped tomatoes. You can leave out the chilli if you prefer","['400g orecchiette', '1 tbsp olive oil', '2 red chillies, deseeded and finely chopped', '2 garlic cloves, crushed', '400g can butter beans, drained and rinsed', '400g can  cherry tomatoes', '1 lemon, zested and juiced', '½ large bunch of parsley, finely chopped', '25g grated parmesan or vegetarian alternative (optional)']","['Cook the orecchiette following pack instructions until al dente, about 10 mins. Drain, reserving the cooking water.', 'Meanwhile, heat the olive oil in a large frying pan over a medium heat and fry the chillies and garlic for 2 mins until just softened. Mix in the butter beans, tomatoes, lemon zest and juice. Cook for 5 mins more, then scatter in the parsley and cook for another 2 mins. The tomatoes should have reduced slightly and the beans should be warmed through.', 'Tip the orecchiette into the frying pan with the butter bean mixture. Pour in a little of the reserved pasta cooking water if you prefer a looser sauce. Spoon into bowls and sprinkle with the cheese before serving, if you like.']","{'kcal': 422.0, 'fat': 5.0, 'saturates': 1.0, 'carbs': 73.0, 'sugars': 6.0, 'fibre': 8.0, 'protein': 16.0, 'salt': 0.02}",15
Lunch recipes,Quick lunch recipes,https://www.bbcgoodfood.com/recipes/healthy-beef-chow-mein,assets/img/7.jpg,Healthy beef chow mein,Swap your weekly takeaway for this healthy beef chow mein – it's quick to cook and low in fat and calories,"['2 wholemeal noodle nests (85g)', '2 tsp rapeseed or sesame oil', '200g lean fillet steak, fat removed and cut into strips', '1 small red onion (100g), finely chopped', '15g piece of ginger, peeled and finely chopped', '160g chestnut mushrooms, thickly sliced', '2 garlic cloves,  finely chopped', '160g ready-to-eat beansprouts', '1½ tsp tamari', '1 tbsp brown rice vinegar', '4 spring onions (65g), cut into diagonal lengths']","['Cook the noodles following pack instructions. Meanwhile, heat half the oil in a wok and stir-fry the beef over a high heat for 30 seconds until browned. Tip onto a plate, set aside, then add the remaining oil to the wok. Stir-fry the onion and ginger until softened. Add a drop of water to prevent burning, if needed and cook covered for 2-3 mins.', 'Stir in the mushrooms and garlic, and fry until they start to soften (around 3 mins), then add the beansprouts and cook for a minute or two more until piping hot.', 'Mix the tamari and vinegar together in a small bowl with 2 tbsp water. Add the drained noodles to the wok, toss well, then add the tamari mixture, spring onions and the beef. Stir-fry for a few minutes until heated through. Season with plenty of black pepper and serve.']","{'kcal': 407.0, 'fat': 11.0, 'saturates': 3.0, 'carbs': 41.0, 'sugars': 10.0, 'fibre': 8.0, 'protein': 32.0, 'salt': 1.0}",20
Lunch recipes,Quick lunch recipes,https://www.bbcgoodfood.com/recipes/storecupboard-pasta-salad,assets/img/8.jpg,Storecupboard pasta salad,"This pasta salad makes a quick and healthy lunch, or is perfect prepared ahead for a picnic or lunchbox","['2 tsp finely chopped red onion', '1 tsp caper', '1 tbsp pesto', '2 tsp olive oil', '185g can of tuna in spring water, drained', '100g leftover pasta shapes', '3 sundried tomatoes, chopped']","['Mix the onion, capers, pesto and oil. Flake the tuna into a bowl with the pasta and tomatoes, then stir in the pesto mix.']","{'kcal': 189.0, 'fat': 7.0, 'saturates': 2.0, 'carbs': 12.0, 'sugars': 2.0, 'fibre': 2.0, 'protein': 19.0, 'salt': 0.91}",5
Lunch recipes,Quick lunch recipes,https://www.bbcgoodfood.com/recipes/veggie-noodle-pot,assets/img/9.jpg,Veggie noodle pot,This noodle salad with sugar snap peas and baby corn makes a great packed lunch for kids - an easy way to get 2 of their 5 a day,"['100g noodles (rice, soba or egg)', '3 tbsp frozen peas', 'handful sugar snap peas or mangetout, halved lengthways', 'handful baby corn, halved lengthways', '1 spring onion, sliced', '½ red pepper, deseeded and chopped', '1 tbsp reduced-salt soy sauce', '1 tsp clear honey', '½ garlic clove, crushed', 'juice 1/2 lemon', 'grating of fresh ginger (optional)', '1 tbsp olive oil', 'splash of milk', '2 eggs, beaten']","['To make the omelette, heat the olive oil in a small non-stick frying pan. Add a splash of milk to the beaten eggs, then tip into the pan. Stir once and allow to cook over a gentle heat until almost set. Flip (using a plate if necessary) and cook on the other side until cooked through. Tip onto a board and cut into strips. (You can roll the omelette up and cut slices to give you spirals, if you like.)', 'Cook the noodles following pack instructions. Drain and rinse under cold water, then set aside. Meanwhile, mix the dressing ingredients together. Blanch the peas and sugar snap peas, then drain and run under cold water to stop them cooking any further.', 'To assemble the salad, mix the noodles with the baby corn, spring onion, red pepper and green veg, then toss with the dressing and top with strips of omelette.']","{'kcal': 383.0, 'fat': 12.0, 'saturates': 3.0, 'carbs': 53.0, 'sugars': 9.0, 'fibre': 4.0, 'protein': 14.0, 'salt': 1.1}",20
Lunch recipes,Healthy lunch recipes,https://www.bbcgoodfood.com/recipes/vegan-chickpea-curry-jacket-potato,assets/img/10.jpg,Vegan chickpea curry jacket potatoes,"Get some protein into a vegan diet with this tasty chickpea curry jacket. It's an easy midweek meal, or filling lunch that packs a lot of flavour.","['4 sweet potatoes', '1 tbsp coconut oil', '1 ½ tsp  cumin seeds', '1 large onion, diced', '2 garlic cloves, crushed', 'thumb-sized piece  ginger, finely grated', '1 green chilli, finely chopped', '1 tsp garam masala', '1 tsp ground coriander', '½ tsp turmeric', '2 tbsp tikka masala paste', '2 x 400g can  chopped tomatoes', '2 x 400g can  chickpeas, drained', 'lemon wedges and coriander leaves, to serve']","['Heat oven to 200C/180C fan/gas 6. Prick the sweet potatoes all over with a fork, then put on a baking tray and roast in the oven for 45 mins or until tender when pierced with a knife.', 'Meanwhile, melt the coconut oil in a large saucepan over medium heat. Add the cumin seeds and fry for 1 min until fragrant, then add the onion and fry for 7-10 mins until softened.', 'Put the garlic, ginger and green chilli into the pan, and cook for 2-3 mins. Add the spices and tikka masala paste and cook for a further 2 mins until fragrant, then tip in the tomatoes. Bring to a simmer, then tip in the chickpeas and cook for a further 20 mins until thickened. Season.', 'Put the roasted sweet potatoes on four plates and cut open lengthways. Spoon over the chickpea curry and squeeze over the lemon wedges. Season, then scatter with coriander before serving.']","{'kcal': 276.0, 'fat': 9.0, 'saturates': 3.0, 'carbs': 32.0, 'sugars': 12.0, 'fibre': 11.0, 'protein': 12.0, 'salt': 0.3}",60
Lunch recipes,Healthy lunch recipes,https://www.bbcgoodfood.com/recipes/salmon-salad-sesame-dressing,assets/img/11.jpg,Salmon salad with sesame dressing,"Get three of your 5-a-day, plus healthy omega-3 fatty acids, vitamin C, folate and fibre in this quick, easy and low-calorie salad","['250g new potatoes, sliced', '160g French beans, trimmed', '2 wild salmon fillets', '80g salad leaves', '4 small clementines, 3 sliced, 1 juiced ', 'handful of basil, chopped', 'handful of  coriander, chopped ', '2 tsp sesame oil', '2 tsp tamari', '½ lemon, juiced', '1 red chilli, deseeded and chopped', '2 tbsp finely chopped onion (¼ small onion)']","['Steam the potatoes and beans in a steamer basket set over a pan of boiling water for 8 mins. Arrange the salmon fillets on top and steam for a further 6-8 mins, or until the salmon flakes easily when tested with a fork.', 'Meanwhile, mix the dressing ingredients together along with the clementine juice. If eating straightaway, divide the salad leaves between two plates and top with the warm potatoes and beans and the clementine slices. Arrange the salmon fillets on top, scatter over the herbs and spoon over the dressing. If taking to work, prepare the potatoes, beans and salmon the night before, then pack into a rigid airtight container with the salad leaves kept separate. Put the salad elements together and dress just before eating to prevent the leaves from wilting.']","{'kcal': 478.0, 'fat': 22.0, 'saturates': 4.0, 'carbs': 35.0, 'sugars': 17.0, 'fibre': 9.0, 'protein': 30.0, 'salt': 0.99}",23
Lunch recipes,Healthy lunch recipes,https://www.bbcgoodfood.com/recipes/smoky-tomato-chipotle-charred-corn-soup,assets/img/12.jpg,"Smoky tomato, chipotle & charred corn soup","Dig out the chipotle paste and make this punchy smoky tomato, chipotle and charred sweetcorn soup. An easy midweek meal, you can freeze any leftovers ","['1 tbsp rapeseed oil', '1 onion, finely chopped', '2 garlic cloves, chopped', '2 tsp ground coriander', 'small bunch of  coriander, stalks chopped and leaves left whole', '400g can chopped  tomatoes', '600ml vegetable stock', '1-1½ tbsp  chipotle chilli paste', '2 corn on the cobs', '50g feta, crumbled', '4 tbsp fat-free  Greek yogurt']","['Heat the oil in a casserole dish and fry the onion for 10 mins until beginning to soften. Add the garlic, ground coriander and coriander stalks, and cook for 1 min. Stir though the tomatoes, stock and chipotle and bring to a simmer. Cook, covered, over a low heat for 20 mins, stirring occasionally.', 'Meanwhile, bring a pan of water to the boil and cook the corn for 4 mins. Drain and leave to cool a little. Cut the kernels off the cob with a sharp knife. Heat a non-stick frying pan over a high heat. Add the corn and fry for 5-7 mins or until charred, stirring now and again.', 'Ladle the soup into bowls. Top with the feta, yogurt, charred corn and coriander leaves.']","{'kcal': 185.0, 'fat': 7.0, 'saturates': 2.0, 'carbs': 16.0, 'sugars': 11.0, 'fibre': 6.0, 'protein': 11.0, 'salt': 0.8}",40
Lunch recipes,Healthy lunch recipes,https://www.bbcgoodfood.com/recipes/lemon-spinach-rice-with-feta,assets/img/13.jpg,Lemon & spinach rice with feta,"Pack in spinach, feta and walnuts into this rice dish. It's bursting with nutrients, including vitamin K, which is important for our skin, hair and bones","['1 tbsp rapeseed oil', '2 onions (320g), finely chopped', '3 large garlic cloves, sliced', '300g easy-cook brown rice', '700ml hot vegetable stock, made with 1 tsp bouillon powder', '400g frozen spinach', '15g dill, finely chopped', '1 lemon, zested, 1/2 juiced, 1/2 cut into 4 wedges', '40g walnuts, chopped', '75g feta, crumbled']","['Heat the oil in a large pan over a medium heat and fry the onions and garlic for 10 mins, stirring often until softened.', 'Tip in the rice, then the stock, frozen spinach and half each of the dill and lemon zest. Cover, reduce the heat to low and cook for 25 mins until the rice is tender.', 'Scatter over the remaining dill and lemon zest, the nuts and feta, then gently toss together along with the lemon juice. Serve half of the rice straightaway with two lemon wedges on the side for squeezing over. Leave the rest of the rice to cool completely and keep chilled for up to three days. Reheat in the microwave until piping hot, then serve with the remaining lemon wedges.This recipe is part of our free 7-day healthy diet plan. To access the full meal plan, click here.']","{'kcal': 495.0, 'fat': 17.0, 'saturates': 4.0, 'carbs': 67.0, 'sugars': 6.0, 'fibre': 8.0, 'protein': 15.0, 'salt': 0.9}",55
Lunch recipes,Healthy lunch recipes,https://www.bbcgoodfood.com/recipes/healthy-pesto-eggs-on-toast,assets/img/14.jpg,Healthy pesto eggs on toast,"Try a speedy, low-fat pesto as a delicious alternative to oil for frying eggs - it adds great flavour to the dish, too, to make a perfect brunch or lunch","['2-4 thin slices rye sourdough (about 70g total, depending on the size of the loaf)', '2 eggs', '170g tomatoes on-the-vine', '160g baby spinach', 'pinch of chilli flakes (optional)', '1 garlic clove', '10g basil', '1 tbsp pine nuts', '1 tbsp rapeseed oil', '1 tbsp finely grated parmesan or vegetarian alternative']","['To make the pesto, peel the garlic clove and put in a small food processor along with the basil, pine nuts, oil and 2 tbsp water. Blitz until smooth, then stir in the cheese. Or, blitz using a hand blender.', ' Toast the bread and divide between two plates. Cook the pesto in a frying pan over a medium heat for 30 seconds, stirring. Crack the eggs into one side of the pan, put the tomatoes in the other, and fry in the pesto until the eggs are cooked to your liking.', 'Lift out the eggs and put each one on a slice of toast. Add the spinach to the pan with the tomatoes, turn the heat up to high and cook until wilted, about 2-3 mins. The tomatoes should be soft. Spoon the veg onto the other toast slice and sprinkle with the chilli flakes, if you like.']","{'kcal': 287.0, 'fat': 17.0, 'saturates': 3.0, 'carbs': 17.0, 'sugars': 4.0, 'fibre': 4.0, 'protein': 15.0, 'salt': 0.8}",20
Lunch recipes,Healthy lunch recipes,https://www.bbcgoodfood.com/recipes/tomato-black-bean-taco-salad,assets/img/15.jpg,Tomato & black bean taco salad,"Enjoy this refreshing taco salad on a warm evening when you’re craving something quick, fresh and crunchy, or as a side for a Mexican-style feast","['1 lime, juiced', '12g coriander, finely chopped', '½ tsp ground cumin', '1 jalapeño pepper (deseeded if you prefer less heat), finely chopped', '2 tbsp rapeseed oil', '400g can black beans, drained and rinsed', '200g cherry tomatoes, halved', '1 romaine lettuce, chopped', '198g can  sweetcorn, drained', '1 red pepper, finely chopped', '4 crunchy taco shells', '25g pumpkin seeds']","['Combine the lime juice, coriander, cumin, jalapeño and oil in a bowl. Season well.', 'Tip in the beans, tomatoes, lettuce, corn and red pepper. Toss to combine. Crumble in the taco shells and mix to coat everything in the dressing. Scatter over the pumpkin seeds and serve straightaway.']","{'kcal': 301.0, 'fat': 13.0, 'saturates': 2.0, 'carbs': 28.0, 'sugars': 9.0, 'fibre': 12.0, 'protein': 11.0, 'salt': 0.1}",20
Lunch recipes,Healthy lunch recipes,https://www.bbcgoodfood.com/recipes/chicken-satay-salad,assets/img/16.jpg,Chicken satay salad,"Try this no-fuss, midweek meal that's high in protein and big on flavour. Marinate chicken breasts, then drizzle with a punchy peanut satay sauce","['1 tbsp tamari', '1 tsp medium curry powder', '¼ tsp ground cumin', '1 garlic clove, finely grated', '1 tsp clear honey', '2 skinless chicken breast fillets (or use turkey breast)', '1 tbsp crunchy peanut butter (choose a sugar-free version with no palm oil, if possible)', '1 tbsp sweet chilli sauce', '1 tbsp lime juice', 'sunflower oil, for wiping the pan', '2 Little Gem lettuce hearts, cut into wedges', '¼ cucumber, halved and sliced', '1 banana shallot, halved and thinly sliced', 'coriander, chopped', 'seeds from ½ pomegranate']","['Pour the tamari into a large dish and stir in the curry powder, cumin, garlic and honey. Mix well. Slice the chicken breasts in half horizontally to make 4 fillets in total, then add to the marinade and mix well to coat. Set aside in the fridge for at least 1 hr, or overnight, to allow the flavours to penetrate the chicken.', 'Meanwhile, mix the peanut butter with the chilli sauce, lime juice, and 1 tbsp water to make a spoonable sauce. When ready to cook the chicken, wipe a large non-stick frying pan with a little oil. Add the chicken and cook, covered with a lid, for 5-6 mins on a medium heat, turning the fillets over for the last min, until cooked but still moist. Set aside, covered, to rest for a few mins.', 'While the chicken rests, toss the lettuce wedges with the cucumber, shallot, coriander and pomegranate, and pile onto plates. Spoon over a little sauce. Slice the chicken, pile on top of the salad and spoon over the remaining sauce. Eat while the chicken is still warm.']","{'kcal': 353.0, 'fat': 10.0, 'saturates': 2.0, 'carbs': 24.0, 'sugars': 21.0, 'fibre': 7.0, 'protein': 38.0, 'salt': 1.6}",20
Lunch recipes,Healthy lunch recipes,https://www.bbcgoodfood.com/recipes/veggie-olive-wraps-mustard-vinaigrette,assets/img/17.jpg,Veggie olive wraps with mustard vinaigrette,"Eat the rainbow with our simple, healthy, veggie wrap. This olive and veg sandwich makes an easy vegan, low-calorie lunch option to eat al-desko","['1 carrot, shredded or coarsely grated', '80g wedge red cabbage, finely shredded', '2 spring onions, thinly sliced', '1 courgette, shredded or coarsely grated', 'handful basil leaves', '5 green olives, pitted and halved', '½ tsp English mustard powder', '2 tsp extra virgin rapeseed oil', '1 tbsp cider vinegar', '1 large seeded tortilla']","['Mix all the ingredients except for the tortilla and toss well.', 'Put the tortilla on a sheet of foil and pile the filling along one side of the wrap – it will almost look like too much mixture, but once you start to roll it firmly it will compact. Roll the tortilla from the filling side, folding in the sides as you go. Fold the foil in at the ends to keep stuff inside the wrap. Cut in half and eat straight away. If taking to work, leave whole and wrap up like a cracker in baking parchment.']","{'kcal': 281.0, 'fat': 12.0, 'saturates': 2.0, 'carbs': 31.0, 'sugars': 12.0, 'fibre': 10.0, 'protein': 8.0, 'salt': 0.9}",10
