Main Category,Sub-Category,url,image,name,description,ingredients,steps,nutrients,times
Breakfast recipes,Breakfast muffins,https://www.bbcgoodfood.com/recipes/welsh-rarebit-muffins,assets/img/166.jpg,Welsh rarebit muffins,"Get the kids to help make these yummy muffins, perfect for lunchboxes","['225g self-raising flour', '50g plain flour', '1 tsp baking powder', '½ level tsp bicarbonate of soda', '¼ tsp salt', '½ level tsp mustard  powder', '100g strong cheese, half grated, half cubed', '6 tbsp vegetable oil', '150g Greek yogurt', '125ml milk', '1 egg', '1 tbsp Worcestershire sauce']","['Heat oven to 200C/fan 180C/gas 6.', 'Mix together the self-raising and plain flour, baking powder, bicarbonate of soda, salt and mustard powder in a bowl.', 'In a separate bowl, mix the cheese, oil, yogurt, milk, egg and Worcestershire sauce.', 'Combine all the ingredients and divide between the muffin cases in the muffin tin.', 'Place in the oven for 20-25 mins until golden. Remove and cool slightly on a rack.', 'What you need: Ask the kids to help get everything ready, weighing scales, measuring jug, fork, 2 mixing bowls, 12 paper muffin cases, muffin tin, cheese grater, sharp knife, tablespoon, cooling rack.']","{'kcal': 189.0, 'fat': 11.0, 'saturates': 4.0, 'carbs': 19.0, 'sugars': 1.0, 'fibre': 1.0, 'protein': 6.0, 'salt': 0.79}",40
Breakfast recipes,Breakfast muffins,https://www.bbcgoodfood.com/recipes/choc-cherry-muffins,assets/img/167.jpg,Choc-cherry muffins,"If you’ve got a spare half-an-hour, whip up these easy muffins and freeze them for when you need them","['250g self-raising flour', '1 tsp bicarbonate of soda', '140g dried sour  cherry', '100g bar  white chocolate, cut into chunks', '100g bar  dark chocolate, cut into chunks', '100g golden caster sugar', '2 eggs, beaten', '150ml pot  natural yogurt', '100g butter, melted']","['Heat oven to 200C/fan 180C/gas 6 and line a 12-hole muffin tin with some paper cases. Sift the flour, and bicarbonate of soda into a large bowl, then stir in the cherries, chocolate and sugar. Add the beaten eggs, yogurt and then the butter and stir to combine. It doesn’t matter if the mixture looks a bit lumpy, it’s more important not to overmix or the muffins will turn out tough.', 'Fill the paper cases and bake for 20-25 mins until risen and golden brown. Transfer to a rack to cool. They are especially delicious eaten slightly warm.']","{'kcal': 386.0, 'fat': 13.0, 'saturates': 6.0, 'carbs': 45.0, 'sugars': 18.0, 'fibre': 1.0, 'protein': 5.0, 'salt': 0.73}",40
Breakfast recipes,Breakfast pancakes,https://www.bbcgoodfood.com/recipes/breakfast-pancake-platter,assets/img/168.jpg,Breakfast pancake platter,"Serve a base of wholemeal American-style pancakes alongside a range of toppings. Go sweet with fruit and yogurt, or savoury with soft cheese and salmon","['100g wholemeal plain spelt flour', '2 eggs, whites and yolks separated', '150ml semi-skimmed milk', 'drop of oil, for cooking (optional)', '100g cooked salmon, broken into large flakes', '85g low-fat soft cheese', '1⁄4  cucumber, sliced', '1⁄2 lemon, cut into wedges', '1 small red onion, thinly sliced', '2 x 120g pots natural bio yogurt', '1 banana, peeled and sliced', '160g mixed berries (we used blueberries, raspberries and cherries)', 'capers dill and sliced spring onions, walnuts, mixed seeds, ground cinnamon and maple syrup, to serve (optional)']","['Tip the flour into a bowl, then whisk in the egg yolks and half the milk until smooth. Slowly whisk in the rest of the milk (the batter will be runny). Whisk the egg whites to soft peaks in a separate bowl, then gently fold this into the batter.', 'Heat a large non-stick pan over a medium heat and wipe a drop of oil around the base using a kitchen towel. Spoon in 2 tbsp of batter per pancake (you should be able to make three at a time, well- spaced apart) and cook for 2-3 mins until bubbles appear on the surface and the bottom is set. Flip using a palette knife and cook for 2-3 mins more. Arrange the pancakes in a single layer over a large serving platter, then top one side with the salmon, soft cheese, cucumber slices, lemon wedges and onion slices. Top the other side with the yogurt, banana slices and berries. If you like, scatter the savoury pancakes with the capers, dill and spring onions, if using, and top the sweet pancakes with walnuts, seeds, cinnamon and maple syrup. Or, serve these on the side for everyone to help themselves.']","{'kcal': 371.0, 'fat': 16.0, 'saturates': 5.0, 'carbs': 32.0, 'sugars': 16.0, 'fibre': 6.0, 'protein': 22.0, 'salt': 0.5}",30
Breakfast recipes,Breakfast pancakes,https://www.bbcgoodfood.com/recipes/fluffy-pancakes,assets/img/169.jpg,Fluffy American pancakes,Fluffy American-style pancakes are a blank canvas for toppings like blueberries and bacon – great for breakfast in bed. Why not get the kids to help?,"['8 slices  pancetta, to serve (optional)', 'sunflower oil and butter, for cooking', 'blueberries, to serve (optional)', '300g self-raising flour', '1 tsp baking powder', '1 tbsp caster sugar', '2 medium  eggs', '1 tbsp maple syrup, plus extra to serve', '300ml milk']","['If serving with pancetta, heat oven to 200C/180C fan/gas 6. Line a baking tray with baking parchment and lay on the pancetta in a single layer. Put another piece of parchment on top, followed by a second baking tray, and bake for 12-15 mins until crisp.', 'To make the pancakes, get a little helper to weigh out and tip the flour, baking powder and sugar into a large bowl with a small pinch of salt. Crack in the eggs and whisk until smooth. Add the maple syrup and milk while whisking.', 'Heat a splash of oil and a small knob of butter in a non-stick frying pan until sizzling. Add spoonfuls of batter to make pancakes the size you like, we made 20cm pancakes for a serving size of one per person, or if you are very hungry, two per person. Cook until bubbles start to form on the surface, then flip and cook the other side. Eat straight away or keep warm in a low oven while you cook another batch. Serve pancakes with pancetta or blueberries, drizzled with extra maple syrup.']","{'kcal': 251.0, 'fat': 5.0, 'saturates': 2.0, 'carbs': 43.0, 'sugars': 8.0, 'fibre': 2.0, 'protein': 8.0, 'salt': 1.0}",30
Breakfast recipes,Breakfast pancakes,https://www.bbcgoodfood.com/recipes/banana-oat-pancakes,assets/img/170.jpg,Banana oat pancakes,Make our healthier pancakes using rolled oats and banana for natural sweetness. Serve with a dollop of creamy yogurt and fresh fruit,"['125ml oat milk', '2 eggs, separated', '1 small banana', '100g rolled oats', '2 tsp baking powder', 'few drops of vanilla extract', 'oil,  we used avocado oil spray', 'low-fat yogurt and fruit to top']","['Put the oat milk, egg yolks, banana, oats, baking powder and vanilla in a blender and process to as smooth a mixture as you can get. Whisk the eggs whites until they hold stiff peaks. Whisk 1-2 tbsp of the whites into the batter, then fold in the rest.', 'Heat a non-stick pan over a medium heat and spray with a whisper of oil, pour about 2 tbsp of batter into the pan and cook for 1-2 mins, until the base sets and bubbles appear all over the top. Flip and cook the other side for a minute. Repeat in batches, making sure the top looks dryish before attempting the flip, or the centre will collapse.']","{'kcal': 350.0, 'fat': 9.9, 'saturates': 2.5, 'carbs': 46.0, 'sugars': 9.8, 'fibre': 5.0, 'protein': 15.0, 'salt': 1.4}",20
Breakfast recipes,Breakfast pancakes,https://www.bbcgoodfood.com/recipes/vegan-banana-pancakes,assets/img/171.jpg,Vegan banana pancakes,"Make these foolproof vegan banana pancakes. A guaranteed crowd pleaser with a fluffy, light texture, you'd never know they’re dairy and egg-free","['1 large ripe banana (around 150g)', '2 tbsp golden caster sugar', '¼ tsp  fine salt', '2 tbsp vegetable oil, plus extra for cooking', '120g self-raising flour', '½ tsp baking powder', '150ml oat, almond milk or soya milk', 'syrup, sliced banana and berries, to serve (optional)']","['Mash the banana in a mixing bowl. Stir in the sugar, salt and oil. Add the flour and baking powder and mix thoroughly. Make a well in the centre and gradually whisk in the milk. The batter should be a thick, droppable consistency.', 'Heat a little oil in a frying pan over a medium heat. Add 2 tbsp of the batter to make American-style pancakes. You will be able to make about 4-5 at a time. Fry on each side for 2-3 mins until golden. Serve with syrup, sliced banana and berries, if you like.']","{'kcal': 94.0, 'fat': 4.0, 'saturates': 0.0, 'carbs': 14.0, 'sugars': 6.0, 'fibre': 1.0, 'protein': 1.0, 'salt': 0.2}",22
Breakfast recipes,Breakfast pancakes,https://www.bbcgoodfood.com/recipes/quick-crepes-suzette,assets/img/172.jpg,Quick crêpes Suzette,A simple way to celebrate Pancake Day without piling on the pounds,"[""4 pancakes  (see 'goes well with' for recipe, or buy ready-made)"", '100g golden caster sugar', 'juice 2 and zest 1 orange, plus extra wedges, to serve (optional)', 'small knob butter', 'half-fat crème fraîche, to serve (optional)']","['Tip the sugar into a microwaveable bowl and stir in 3 tbsp orange juice to dampen. Microwave on High for 3-4 mins until you have a bubbling caramel. Remove the bowl from the microwave (watch out – it will be very hot indeed), then add the rest of juice, zest and butter. Return to the microwave and blast for 1 min, stir, then cook for 1 more min until the caramel has dissolved into the juice and you have a syrupy sauce. Set aside.', 'Heat pancakes in the microwave according to pack instructions. Serve each folded into quarters with sauce poured over, a spoonful of crème fraîche and orange wedges, if you like.']","{'kcal': 254.0, 'fat': 5.0, 'saturates': 3.0, 'carbs': 51.0, 'sugars': 31.0, 'fibre': 1.0, 'protein': 5.0, 'salt': 0.66}",20
Breakfast recipes,Breakfast pancakes,https://www.bbcgoodfood.com/recipes/easy-pancakes,assets/img/173.jpg,Easy pancakes,Learn a skill for life with our foolproof easy crêpe recipe that ensures perfect pancakes every time – elaborate flip optional,"['100g plain flour', '2 large eggs', '300ml milk', '1 tbsp sunflower or vegetable oil, plus a little extra for frying', 'lemon wedges to serve (optional)', 'caster sugar to serve (optional)']","['Put 100g plain flour, 2 large eggs, 300ml milk, 1 tbsp sunflower or vegetable oil and a pinch of salt into a bowl or large jug, then whisk to a smooth batter.', 'Set aside for 30 mins to rest if you have time, or start cooking straight away.', 'Set a medium frying pan or crêpe pan over a medium heat and carefully wipe it with some oiled kitchen paper.', 'When hot, cook your pancakes for 1 min on each side until golden, keeping them warm in a low oven as you go.', 'Serve with lemon wedges and caster sugar, or your favourite filling. Once cold, you can layer the pancakes between baking parchment, then wrap in cling film and freeze for up to 2 months.']","{'kcal': 61.0, 'fat': 2.0, 'saturates': 1.0, 'carbs': 7.0, 'sugars': 1.0, 'fibre': 0.0, 'protein': 3.0, 'salt': 0.1}",30
Breakfast recipes,Breakfast pancakes,https://www.bbcgoodfood.com/recipes/banana-cinnamon-pancakes-blueberry-compote,assets/img/174.jpg,Banana & cinnamon pancakes with blueberry compote,"Make a batch of these pancakes for a delicious low-cal breakfast. With wholemeal flour to make them more filling, they're topped with an easy blueberry sauce","['65g wholemeal flour', '1 tsp ground cinnamon, plus extra for sprinkling', '2 egg, plus 2 egg whites', '100ml whole milk', '1 small banana, mashed', '½ tbsp rapeseed oil', '320g blueberries', 'few mint leaves, to serve']","['Tip the flour and cinnamon into a bowl, then break in the whole eggs, pour in the milk and whisk together until smooth. Stir in the banana. In a separate bowl, whisk the egg whites until light and fluffy, but not completely stiff, then fold into the pancake mix until evenly incorporated.', 'Heat a small amount of oil in a large non-stick frying pan, then add a quarter of the pancake mix, swirl to cover the base of the pan and cook until set and golden. Carefully turn the pancake over with a palette knife and cook the other side. Transfer to a plate, then carry on with the rest of the batter until you have four.', 'To make the compote, tip the berries in a non-stick pan and heat gently until the berries just burst but hold their shape. Serve two warm pancakes with half the berries, then scatter with the mint leaves and sprinkle with a little cinnamon. Chill the remaining pancakes and compote and serve the next day. You can reheat them in the microwave or in a pan.']","{'kcal': 185.0, 'fat': 6.0, 'saturates': 1.0, 'carbs': 23.0, 'sugars': 12.0, 'fibre': 3.0, 'protein': 9.0, 'salt': 0.2}",25
Breakfast recipes,Breakfast pancakes,https://www.bbcgoodfood.com/recipes/classic-pancakes,assets/img/175.jpg,Classic pancakes,You can use this foolproof classic batter recipe to create a base for sweet or savoury pancakes,"['100g plain flour', '1 large egg', '300ml milk', 'oil  or melted butter, for frying']","['Sift the flour and a pinch of salt into a bowl. Make a well in the centre with the back of a spoon then break in the egg and pour in half the milk. Whisk together, gradually incorporating the flour to make a smooth thick batter. Beat thoroughly to remove any lumps, then stir in the rest of the milk.', 'Heat a little oil or butter in a medium frying pan, then tip off the excess into a bowl. Pour about 2 tablespoons of batter into the pan, tilting the pan as you pour, until the batter thinly coats the base. Cook over a moderate heat for 30 seconds to one minute until golden brown on the underside.', 'Flip over the pancake with a palette knife, and cook the other side until it is golden brown. Slide the pancake out of the pan on to a plate, heat a little more oil or butter and cook the remaining pancakes one at a time in the same way.', 'If preparing in advance, cook and stack the pancakes. Reheat in the microwave on Medium (750W) for about 2 minutes. Alternatively, heat the oven to 180C/gas 4/fan 160C. Wrap the pancakes in foil and warm them through in the oven for 10 minutes.']","{'kcal': 117.0, 'fat': 7.0, 'saturates': 4.0, 'carbs': 12.0, 'sugars': 0.0, 'fibre': 0.0, 'protein': 3.0, 'salt': 0.2}",30
Breakfast recipes,Breakfast pancakes,https://www.bbcgoodfood.com/recipes/perfect-pancakes-recipe,assets/img/176.jpg,Perfect pancakes recipe,An easy pancake batter recipe with tips on how to make the best pancakes every time with sweet or savoury toppings,"['100g plain flour', '2 eggs', '300ml semi-skimmed milk', '1 tbsp sunflower oil  or vegetable, plus extra for frying', 'pinch salt']","['Put 100g plain flour and a pinch of salt into a large mixing bowl.', 'Make a well in the centre and crack 2 eggs into the middle.', 'Pour in about 50ml from the 300ml of semi-skimmed milk and 1 tbsp sunflower oil then start whisking from the centre, gradually drawing the flour into the eggs, milk and oil. Once all the flour is incorporated, beat until you have a smooth, thick paste. Add a little more milk if it is too stiff to beat.', 'Add a good splash of milk and whisk to loosen the thick batter. While still whisking, pour in a steady stream of the remaining milk. Continue pouring and whisking until you have a batter that is the consistency of slightly thick single cream.', 'Heat the pan over a moderate heat, then wipe it with oiled kitchen paper.', 'Ladle some batter into the pan, tilting the pan to move the mixture around for a thin and even layer. Quickly pour any excess batter into the mixing bowl, return the pan to the heat.', 'Leave to cook, undisturbed, for about 30 secs. If the pan is the right temperature, the pancake should turn golden underneath after about 30 secs and will be ready to turn.', 'Hold the pan handle, ease a palette knife under the pancake, then quickly lift and flip it over. Make sure the pancake is lying flat against the base of the pan with no folds, then cook for another 30 secs before turning out onto a warm plate.', 'Continue with the rest of the batter, serving them as you cook or stack onto a plate. You can freeze the pancakes for 1 month, wrapped in cling film or make them up to a day ahead.']","{'kcal': 107.0, 'fat': 5.0, 'saturates': 1.0, 'carbs': 12.0, 'sugars': 2.0, 'fibre': 0.0, 'protein': 4.0, 'salt': 0.1}",30
Breakfast recipes,Breakfast pancakes,https://www.bbcgoodfood.com/recipes/american-style-pineapple-banana-pancakes,assets/img/177.jpg,American-style pineapple & banana pancakes,These American-style pancakes are easier to make than traditional ones,"['100g/4oz fresh or drained canned  pineapple', '1 banana, sliced', '100g self-raising flour', '1 tsp baking powder', '1 tsp cinnamon', '3 tbsp light muscovado sugar', '1 egg', '100ml milk', 'sunflower oil, for frying', 'Greek  yogurt  and maple syrup, to serve']","['Roughly chop the pineapple and slice the banana. Tip the flour, baking powder, cinnamon and sugar into a bowl and mix well.', 'Make a well into the centre and crack in the egg, then gradually mix the egg into the flour, adding the milk gradually to make a soft batter.', 'Stir in the pineapple and banana. Heat a little oil in a non-stick frying pan, add the batter in heaped tablespoonsful, well apart to allow them to spread. When bubbles appear on the surface, flip the pancakes over and cook until light golden.', 'Cook all the pancakes and keep them warm. Serve 2-3 pancakes with a spoonful of yogurt and a little maple syrup poured over.']","{'kcal': 230.0, 'fat': 6.0, 'saturates': 1.0, 'carbs': 42.0, 'sugars': 11.0, 'fibre': 1.0, 'protein': 6.0, 'salt': 0.7}",20
Breakfast recipes,Breakfast pancakes,https://www.bbcgoodfood.com/recipes/gluten-free-pancakes,assets/img/178.jpg,Gluten-free pancakes,Use special flour to make these quick and easy crêpes and safely cater for those on a gluten-free diet. Perfect for both sweet and savoury toppings,"['125g gluten-free plain flour', '1 egg', '250ml milk', 'butter, for frying']","['Put the flour in a bowl and make a well in the centre. Crack the egg in the middle and pour in a quarter of the milk. Use an electric or balloon whisk to thoroughly combine the mixture. Once you have a paste, mix in another quarter and once lump free, mix in the remaining milk. Leave to rest for 20 mins. Stir again before using.', 'Heat a small non-stick frying pan with a knob of butter. When the butter starts to foam, pour a small amount of the mixture into the pan and swirl around to coat the base – you want a thin layer. Cook for a few mins until golden brown on the bottom, then turn over and cook until golden on the the other side. Repeat until you have used all the mixture, stirring the mixture between pancakes and adding more butter for frying as necessary.', 'Serve with agave syrup and a squeeze of orange juice or your pancake filling of choice.']","{'kcal': 119.0, 'fat': 3.5, 'saturates': 1.8, 'carbs': 16.1, 'sugars': 1.9, 'fibre': 0.1, 'protein': 6.0, 'salt': 0.1}",30
Breakfast recipes,Breakfast pancakes,https://www.bbcgoodfood.com/recipes/easiest-ever-pancakes,assets/img/179.jpg,Easiest ever pancakes,"This simple batter, based on equal volumes of eggs, milk and flour, produces thick pancakes, ready for your favourite fillings","['140g plain flour (this is about 200ml/7fl oz)', '4 eggs (200ml/7fl oz)', '200ml milk', '50g butter, melted', 'sunflower oil, for cooking']","['To make the batter, tip the flour into a bowl and beat in the eggs until smooth. Gradually add the milk and carry on beating until the mix is completely lump-free.', 'Now whisk in the melted butter. Place a pancake pan over a medium heat and wipe with oiled kitchen paper. Ladle some batter into the pan, tilting the pan to move the mix around the pan and pour off any excess. Cook for about 30 secs until golden, then flip over and cook on the other side. Pile the pancakes up and serve with your favourite filling.']","{'kcal': 209.0, 'fat': 17.0, 'saturates': 4.0, 'carbs': 10.0, 'sugars': 1.0, 'fibre': 0.0, 'protein': 4.0, 'salt': 0.14}",25
Breakfast recipes,Overnight oat recipes,https://www.bbcgoodfood.com/recipes/banana-overnight-oats,assets/img/180.jpg,Banana overnight oats,"Rustle up these easy overnight oats made with bananas, nut butter and almonds for a tasty breakfast. Prepped the night before, they're ideal for busy mornings","['2 bananas,  peeled', '100g  porridge oats', '¼ tsp  ground cinnamon, plus a pinch to serve', '1 tbsp  maple syrup', '300ml  milk of your choice, plus a splash ', '2 tbsp  peanut or almond butter, plus extra to serve ', '2 tbsp flaked or chopped  almonds', '2-4 tbsp  natural yogurt, to serve (optional) ']","['Mash 1 banana in a bowl with a fork until smooth. Stir in the oats, cinnamon, maple syrup, milk and peanut butter. Mix well, then cover and chill overnight.', 'The next morning, stir the porridge, adding another splash of milk if the mixture is quite stiff. Divide between two bowls. Slice the remaining banana and scatter this over the porridge, drizzle with more nut butter and sprinkle over the almonds. Top with spoonfuls of yogurt, if using, and sprinkle with a pinch more cinnamon before serving.']","{'kcal': 557.0, 'fat': 23.0, 'saturates': 5.0, 'carbs': 65.0, 'sugars': 28.0, 'fibre': 6.0, 'protein': 20.0, 'salt': 0.3}",5
Breakfast recipes,Overnight oat recipes,https://www.bbcgoodfood.com/recipes/pbj-overnight-oats,assets/img/181.jpg,Peanut butter overnight oats,Make a bowl of overnight oats that's indulgent yet healthy with creamy peanut butter and tangy raspberries. Or make it in a jar and take it to work,"['80g frozen raspberries', '50g rolled porridge oats', '1 tsp maple syrup', '1 tbsp peanut butter']","['Stir the frozen raspberries into your oats with 150ml water and a pinch of salt, then cover and chill in the fridge overnight.', 'The next day, mix in the maple syrup, then top the oats with the peanut butter.']","{'kcal': 345.0, 'fat': 12.0, 'saturates': 3.0, 'carbs': 44.0, 'sugars': 9.0, 'fibre': 8.0, 'protein': 11.0, 'salt': 0.6}",5
Breakfast recipes,Overnight oat recipes,https://www.bbcgoodfood.com/recipes/tropical-overnight-oats,assets/img/182.jpg,Tropical overnight oats,"Give your breakfast a tropical twist with our overnight oats. This healthy, low-fat recipe takes minutes to prepare and can be made in a jar to take to work","['50g rolled porridge oats', '20g coconut yogurt', '2 sliced kiwis', '1 passion fruit', '½ tsp toasted mixed seeds']","['Soak the oats in 150ml water with a pinch of salt, then cover and chill in the fridge overnight.', 'The next day spoon half the oats into a bowl. Layer with the coconut yogurt, sliced kiwis, the pulp of the passion fruit and the rest of the oats, then top with the toasted mixed seeds.']","{'kcal': 325.0, 'fat': 9.0, 'saturates': 4.0, 'carbs': 48.0, 'sugars': 13.0, 'fibre': 8.0, 'protein': 9.0, 'salt': 0.5}",10
Breakfast recipes,Overnight oat recipes,https://www.bbcgoodfood.com/recipes/raspberry-kefir-overnight-oats,assets/img/183.jpg,Raspberry kefir overnight oats,"Wake up to these healthy, gut-friendly breakfast oats. Prep in just 10 minutes the night before, then top with a layer of berries, dark chocolate and seeds","['85g gluten-free jumbo oats', '1 tbsp shelled hemp seeds, plus 2 tsp to serve', '1 tbsp chia seeds', '2 x 120g pots kefir yogurt', '240g semi-skimmed milk', '125g raspberries, lightly crushed', '2 tsp pumpkin seeds, chopped', '8g 70% cocoa chocolate, finely chopped']","['Tip the oats, 1 tbsp of the hemp seeds and the chia seeds into a bowl, then mix well. Stir in the kefir yogurt and milk. Cover and chill overnight. The mixture will thicken overnight as it soaks.', 'The next morning, spoon into two glass tumblers and top with the raspberries, remaining hemp seeds, the pumpkin seeds and chocolate.']","{'kcal': 442.0, 'fat': 17.0, 'saturates': 5.0, 'carbs': 48.0, 'sugars': 16.0, 'fibre': 9.0, 'protein': 20.0, 'salt': 0.3}",10
Breakfast recipes,Overnight oat recipes,https://www.bbcgoodfood.com/recipes/orange-blueberry-bircher,assets/img/184.jpg,Orange & blueberry Bircher,"Soaking oats and seeds overnight makes them easily digestible. Add in the fruit and you've got a nutritious start to the day with the right kind of fats, fibre, vitamins and minerals","['70g porridge oats', '2 tbsp golden linseeds', 'zest of ½ an orange', '¾ of a 175g tub yogurt', '2 peeled and chopped oranges', '4handfuls blueberries from a 150g pack']","['Mix 70g oats and 2 tbsp golden linseeds with the zest of 1 /2 an orange. Pour over 300ml boiling water and leave overnight. The next day, stir in three-quarters of a 175g tub of yogurt, spoon into glasses or bowls, top with 2 peeled and chopped oranges, the remaining yogurt and 4 handfuls blueberries from a 150g pack.']","{'kcal': 345.0, 'fat': 9.0, 'saturates': 3.0, 'carbs': 48.0, 'sugars': 22.0, 'fibre': 8.0, 'protein': 13.0, 'salt': 0.2}",5
Breakfast recipes,Overnight oat recipes,https://www.bbcgoodfood.com/recipes/berry-bircher,assets/img/185.jpg,Berry Bircher,"Overnight oats that are low in fat and take 5 minutes to prepare. Pack your breakfast with frozen raspberries, bio yogurt and golden linseeds for a delicious and healthy start to the day","['70g porridge oats', '2 tbsp golden linseeds', '2 ripe bananas', '140g frozen raspberries', '175g natural bio yogurt']","['Tip the oats and seeds into a bowl, and pour over 200ml boiling water and stir well. Add the bananas and three-quarters of the raspberries (chill the remainder), mash together, then cover and chill overnight.', 'The next day, layer the raspberry oats in two tumblers or bowls with the yogurt, top with the reserved raspberries and serve.']","{'kcal': 372.0, 'fat': 9.0, 'saturates': 2.0, 'carbs': 55.0, 'sugars': 27.0, 'fibre': 9.0, 'protein': 13.0, 'salt': 0.2}",5
