Main Category,Sub-Category,url,image,name,description,ingredients,steps,nutrients,times
Dinner recipes,Pasta recipes,https://www.bbcgoodfood.com/recipes/fajita-style-pasta,assets/img/83.jpg,Fajita-style pasta,"Take the aromatic flavours of a classic Mexican fajita and combine with pasta for this easy, vibrant meal. It's an ideal Friday night dinner","['2 tbsp  olive oil', '2 large skinless chicken breasts, cut into strips', '1 onion,  thinly sliced', '1 red pepper, deseeded and sliced', '1 yellow pepper, deseeded and sliced', '1 garlic clove, crushed', '1⁄4 tsp chilli powder', '1 heaped tsp sweet smoked paprika', '1⁄2 tsp dried oregano', '1 tsp ground coriander', '1⁄2 tsp ground cumin', '3 tbsp tomato purée', '80ml double cream', '350g penne or rigatoni pasta', '1⁄2 small bunch of flat-leaf parsley, finely chopped', 'grated parmesan or cheddar, to serve']","['Heat the oil in a large shallow casserole or frying pan. Add the chicken and fry for 5 mins over a medium heat until golden all over. Remove and set aside on a plate.', 'Put the onion and peppers in the same pan and fry over a medium heat for 8-10 mins. Add the garlic, dried herbs and spices and cook for 1 min. Add the tomato purée and cook for 2 mins. Return the chicken to the pan and pour in the cream, stirring to combine. Season to taste.', 'Cook the pasta following pack instructions, then drain and reserve 150ml of the cooking water. Add the pasta to the pan with 50ml of the water and stir everything together over the heat. Add a little more water to loosen if needed. Season to taste and stir through the parsley. Divide between six bowls and top with a little cheese and extra chopped parsley, if you like. This can be packed into a lunchbox and eaten cold, too.']","{'kcal': 410.0, 'fat': 13.0, 'saturates': 5.0, 'carbs': 47.0, 'sugars': 6.0, 'fibre': 6.0, 'protein': 24.0, 'salt': 1.0}",35
Dinner recipes,Pasta recipes,https://www.bbcgoodfood.com/recipes/pasta-salmon-peas,assets/img/84.jpg,Pasta with salmon & peas,Make this salmon pasta in under 20 minutes for a dinner the whole family can enjoy. Kids will love the fun-shaped pasta while packing in fibre and omega-3,"['240g wholewheat fusilli', 'knob of butter', '1 large shallot, finely chopped', '140g frozen peas', '2 skinless salmon fillets, cut into chunks', '140g low-fat crème fraîche', '½ low-salt vegetable stock cube', 'small bunch of chives, snipped']","['Bring a pan of water to the boil and cook the fusilli according to the pack instructions.', 'Meanwhile, heat a knob of butter in a saucepan, then add the shallot and cook for 5 mins or until softened.', 'Add the peas, salmon, crème fraîche and 50ml water. Crumble in the stock cube.', 'Cook for 3-4 mins until cooked through, stir in the chives and some black pepper. Then stir through to coat the pasta. Serve in bowls.']","{'kcal': 463.0, 'fat': 19.0, 'saturates': 6.0, 'carbs': 44.0, 'sugars': 5.0, 'fibre': 7.0, 'protein': 25.0, 'salt': 0.2}",17
Dinner recipes,Pasta recipes,https://www.bbcgoodfood.com/recipes/bacon-mushroom-pasta,assets/img/85.jpg,Bacon & mushroom pasta,"A simple one-pan pasta dish with bacon, mushrooms and pesto - ready in under 30 minutes","['400g penne (or other tube shape) pasta', '250g  pack chestnut or button mushrooms, wiped clean', '8  rashers streaky bacon', '4 tbsp pesto (fresh from the chiller cabinet if possible)', '200ml carton 50% fat crème fraîche', 'handful basil leaves']","['Cook the pasta in boiling water in a large non-stick saucepan according to pack instructions. Meanwhile, slice the mushrooms and snip the bacon into bite-size pieces with scissors or a sharp knife.', 'Reserve a few drops of the cooking water in a cup or bowl, then drain the pasta and set aside. Fry the bacon and mushrooms in the same pan until golden, about 5 mins. Keep the heat high so the mushrooms fry in the bacon fat, rather than sweat.', 'Tip the pasta and reserved water back into the pan and stir over the heat for 1 min. Take the pan off the heat, spoon in the pesto and crème fraîche and most of the basil and stir to combine. Sprinkle with the remaining basil to serve.']","{'kcal': 567.0, 'fat': 20.0, 'saturates': 9.0, 'carbs': 78.0, 'sugars': 0.0, 'fibre': 4.0, 'protein': 23.0, 'salt': 1.41}",25
Dinner recipes,Pasta recipes,https://www.bbcgoodfood.com/recipes/italian-broccoli-salmon-bake,assets/img/86.jpg,Italian broccoli & salmon bake,Take a fresh look at broccoli with this creamy pasta bake,"['250g penne', '300g broccoli, cut into large florets', '25g butter', '25g plain flour', '600ml milk', '100g mascarpone', '8 sundried tomatoes (preserved in olive oil), drained and thickly sliced', '2 tbsp small capers (optional) rinsed to remove excess salt or vinegar', '8 anchovy fillets, halved (optional)', '10 large fresh basil leaves, roughly torn', '4 fresh skinless salmon fillets', '50g mature cheddar, finely grated']","['Preheat the oven to 190C/gas 5/fan 170C and get out an ovenproof dish (measuring 20 by 30cm, and about 5cm deep). Meanwhile, put a large pan of water on to boil for the pasta. When it is boiling rapidly, tip in the pasta with a generous sprinkling of salt. Give it a stir, return to the boil and cook for 6 minutes. Add the broccoli, then return the water to the boil and cook for 4 minutes more, until the broccoli is on the firm side of just tender. Drain well.', 'While the pasta is cooking, put the butter, flour and milk in a large pan and heat, whisking or stirring continuously, until it thickens to make a smooth sauce. Remove from the heat and stir in the mascarpone, sun-dried tomatoes, capers (if using), anchovies (if using) and basil, then add the pasta and broccoli and season well.', 'Halve the salmon fillets widthways (you will see that there is an obvious divide on each fillet) then place the pieces in a single layer on the base of the ovenproof dish. Spoon the broccoli mixture on top, then scatter with the grated cheddar. (You can chill this for up to 4 hours if you want to get ahead.)', 'Bake for 30 minutes until the mixture is just starting to bubble round the edges and the mixture is pale golden – don’t let it go too dark or the fish will overcook.']","{'kcal': 817.0, 'fat': 42.0, 'saturates': 18.0, 'carbs': 64.0, 'sugars': 0.0, 'fibre': 5.0, 'protein': 49.0, 'salt': 1.3}",55
Dinner recipes,Pasta recipes,https://www.bbcgoodfood.com/recipes/creamy-courgette-lasagne,assets/img/87.jpg,Creamy courgette lasagne,"Serve this quick, creamy courgette & ricotta lasagne for a last-minute dinner party to impress vegetarian friends. It's a great way to use courgettes when they're in season","['9 dried lasagne  sheets', '1 tbsp sunflower oil', '1 onion, finely chopped', '700g courgette (about 6), coarsely grated', '2 garlic cloves, crushed', '250g tub ricotta', '50g cheddar', '350g jar tomato sauce  for pasta']","['Heat oven to 220C/fan 200C/gas 7. Put a pan of water on to boil, then cook the lasagne sheets for about 5 mins until softened, but not cooked through. Rinse in cold water, then drizzle with a little oil to stop them sticking together.', 'Meanwhile, heat the oil in a large frying pan, then fry the onion. After 3 mins, add the courgettes and garlic and continue to fry until the courgette has softened and turned bright green. Stir in 2/3 of both the ricotta and the cheddar, then season to taste. Heat the tomato sauce in the microwave for 2 mins on High until hot.', 'In a large baking dish, layer up the lasagne, starting with half the courgette mix, then pasta, then tomato sauce. Repeat, top with blobs of the remaining ricotta, then scatter with the rest of the cheddar. Bake on the top shelf for about 10 mins until the pasta is tender and the cheese is golden.']","{'kcal': 405.0, 'fat': 21.0, 'saturates': 8.0, 'carbs': 38.0, 'sugars': 13.0, 'fibre': 4.0, 'protein': 18.0, 'salt': 1.36}",30
Dinner recipes,Pasta recipes,https://www.bbcgoodfood.com/recipes/fennel-spaghetti,assets/img/88.jpg,Fennel spaghetti,"Low fat and low calorie, this fennel spaghetti is a healthy vegetarian meal for two. Make it as an easy midweek meal and garnish with parsley and parmesan","['1 tbsp olive oil, plus extra for serving', '1 tsp fennel seeds', '2 small garlic cloves, 1 crushed, 1 thinly sliced', '1 lemon, zested and juiced', '1 fennel bulb, finely sliced, fronds reserved', '150g spaghetti', '½ pack flat-leaf parsley, chopped', 'shaved parmesan (or vegetarian alternative), to serve (optional)']","['Heat the oil in a frying pan over a medium heat and cook the fennel seeds until they pop. Sizzle the garlic for 1 min, then add the lemon zest and half the fennel slices. Cook for 10-12 mins or until the fennel has softened.', 'Meanwhile, bring a pan of salted water to the boil and cook the pasta for 1 min less than pack instructions. Use tongs to transfer the pasta to the frying pan along with a good splash of pasta water. Increase the heat to high and toss well. Stir through the remaining fennel slices, the parsley and lemon juice, season generously, then tip straight into two bowls to serve. Top with the fennel fronds, extra olive oil and parmesan shavings, if you like.']","{'kcal': 321.0, 'fat': 7.0, 'saturates': 1.0, 'carbs': 51.0, 'sugars': 4.0, 'fibre': 7.0, 'protein': 10.0, 'salt': 0.6}",45
Dinner recipes,Pasta recipes,https://www.bbcgoodfood.com/recipes/creamy-courgette-bacon-pasta,assets/img/89.jpg,Creamy courgette & bacon pasta,A quick and creamy carbonara-style tagliatelle that showcases delicious courgettes contrasted with cream and pancetta,"['1 tsp olive oil', '150g diced pancetta or smoked bacon lardons', '4 courgettes, coarsely grated', '1 garlic clove, crushed', 'handful freshly grated parmesan', '1 small tub (200g) low-fat crème fraîche', '300g tagliatelle']","['Heat the olive oil in a large frying pan and sizzle the pancetta or bacon for about 5 mins until starting to crisp. Turn up the heat and add the grated courgette to the pan. Cook for 5 mins or until soft and starting to brown then add the garlic and cook for a minute longer. Season and set aside.', 'Cook the tagliatelle according to the pack instructions and scoop out a cupful of cooking water. Drain the tagliatelle and tip into the frying pan with the bacon and courgette. Over a low heat toss everything together with the crème fraiche and half the Parmesan adding a splash of pasta water too if you need to loosen the sauce. Season to taste and serve twirled into bowls with the remaining Parmesan scattered over.']","{'kcal': 483.0, 'fat': 18.4, 'saturates': 9.1, 'carbs': 57.0, 'sugars': 6.4, 'fibre': 3.8, 'protein': 21.5, 'salt': 1.2}",30
Dinner recipes,Pasta recipes,https://www.bbcgoodfood.com/recipes/beef-stroganoff-herby-pasta,assets/img/90.jpg,Beef stroganoff with herby pasta,"If you usually serve beef stroganoff with rice, try it with pappardelle pasta instead - it works beautifully with the creamy sauce","['400g beef rump steak, trimmed', '1 tbsp butter', '1 tbsp olive oil', '300g small button mushroom', '400g pappardelle pasta', '3 shallots, finely chopped', '1 tbsp plain flour', '300ml beef stock', '1 tbsp Dijon mustard', '1 tbsp tomato purée', '3 tbsp crème fraîche', '½ x 20g pack flat-leaf parsley, chopped']","['Freeze the beef for 45 mins before you begin, slice as thinly as you can, then season.', 'In a large, non-stick frying pan, melt half the butter with half the oil. Increase the heat, then quickly sear the beef in batches until browned on both sides. Remove the meat and set aside. Repeat with the mushrooms, then set aside with the beef. Boil the pasta.', 'Add the remaining butter and oil to the pan and soften the shallots for a few mins. Stir in the flour for 1 min, then gradually stir in the stock. Bubble for 5 mins until thickened, then stir in the mustard, purée, crème fraîche and seasoning. Bubble for 1 min more, then return the beef and mushrooms to the pan.', 'Drain the pasta, toss with half the parsley, season, then serve with the creamy stroganoff, sprinkled with the remaining parsley.']","{'kcal': 614.0, 'fat': 18.0, 'saturates': 7.0, 'carbs': 81.0, 'sugars': 4.0, 'fibre': 0.0, 'protein': 38.0, 'salt': 0.94}",30
Dinner recipes,Pasta recipes,https://www.bbcgoodfood.com/recipes/chicken-broccoli-pasta-bake,assets/img/91.jpg,Chicken & broccoli pasta bake,This dish can be assembled ready for baking a good few hours ahead - and it's all cooked in one pan,"['350g pasta shells or quills', '200g broccoli, cut into very small florets and the stems thinly sliced', '2 tbsp olive oil', '350g boneless, skinless chicken  breasts, thinly sliced', '175g chestnut mushrooms, quartered', '4 tbsp sundried tomato paste', '80g soft cheese with garlic and herbs', '284ml carton single cream', 'bunch of spring onions, finely sliced', '85g mature cheddar, grated', '1 garlic clove, finely chopped', '50g flaked almonds']","['Heat the oven to 190C/ fan170C/ gas 5. Bring a large pan of salted water to the boil. Throw in 350g pasta shells or quills, stir well and return to the boil.', 'Cook for 6 minutes, then add 200g broccoli, cut into very small florets and stems thinly sliced, and cook for 5-6 minutes more until the pasta is just cooked. Drain well, then return to the pan.', 'Heat 2 tbsp olive oil in a wide pan, add 350g thinly sliced boneless, skinless chicken breasts and fry until lightly browned.', 'Tip in 175g quartered chestnut mushrooms and stir fry for 1 minute, then stir in 4 tbsp sundried tomato paste, 80g soft cheese with garlic and herbs and a 284ml carton single cream.', 'Gently simmer, stirring, until the cheese has melted to thicken the sauce. Season with salt and pepper.', 'Pour the sauce over the pasta, stirring gently until coated, then tip into a shallow ovenproof dish (about 1.7 litre capacity) and level the top.', 'Mix a bunch of finely sliced spring onions, 85g grated mature cheddar, 1 finely chopped garlic clove and 50g flaked almonds for the topping and sprinkle over the pasta. Bake for 20 minutes until golden.']","{'kcal': 665.0, 'fat': 27.0, 'saturates': 10.0, 'carbs': 71.0, 'sugars': 0.0, 'fibre': 4.0, 'protein': 37.0, 'salt': 0.42}",40
Dinner recipes,Pasta recipes,https://www.bbcgoodfood.com/recipes/tuna-pasta-bake,assets/img/92.jpg,Tuna pasta bake,"Whip up this cheap treat using storecupboard ingredients, tinned tuna and sweetcorn","['600g rigatoni', '50g butter', '50g plain flour', '600ml milk', '250g strong cheddar, grated', '2 x 160g cans tuna steak in spring water, drained', '330g can sweetcorn, drained', 'large handful chopped parsley']","['Heat oven to 180C/fan 160C/gas 4.', 'Boil 600g rigatoni for 2 mins less time than stated on the pack.', 'To make the sauce, melt 50g butter in a saucepan and stir in 50g plain flour.', 'Cook for 1 min, then gradually stir in 600ml milk to make a thick white sauce.', 'Remove from the heat and stir in all but a handful of the 250g grated cheddar.', 'Drain the pasta, mix with the white sauce, two 160g drained cans tuna, one 330g drained can sweetcorn and a large handful of chopped parsley, then season.', 'Transfer to a baking dish and top with the rest of the grated cheddar.', 'Bake for 15-20 mins until the cheese on top is golden and starting to brown.']","{'kcal': 752.0, 'fat': 26.0, 'saturates': 15.0, 'carbs': 99.0, 'sugars': 12.0, 'fibre': 4.0, 'protein': 37.0, 'salt': 1.43}",50
Dinner recipes,Pasta recipes,https://www.bbcgoodfood.com/recipes/creamy-ham-leek-mushroom-spaghetti,assets/img/93.jpg,"Creamy ham, leek & mushroom spaghetti",This healthier pasta recipe uses low-fat soft cheese to create a creamy sauce to coat the spaghetti,"['2 tsp olive oil', '2 medium leeks, thinly sliced', '200g chestnut mushroom, sliced', '2 garlic cloves, crushed', '300g spaghetti', '140g low-fat soft cheese', '85g wafer-thin smoked ham, shredded', 'small pack basil', '25g grated parmesan']","['Heat the oil in a large saucepan. Stir in the leeks, 2 tbsp water and some seasoning, cover, then cook for 5 mins over a medium heat until softened. Add the mushrooms and garlic, then cook for 3 mins more. Meanwhile, cook the spaghetti according to pack instructions, then drain, reserving a little of the cooking liquid.', 'Stir the soft cheese into the leek and mushroom mixture, adding enough of the reserved pasta liquid to give a sauce-like consistency. Add the ham, basil leaves and Parmesan, then toss in the spaghetti.']","{'kcal': 384.0, 'fat': 11.0, 'saturates': 5.0, 'carbs': 53.0, 'sugars': 6.0, 'fibre': 8.0, 'protein': 21.0, 'salt': 1.38}",30
Dinner recipes,One pot recipes,https://www.bbcgoodfood.com/recipes/prawn-jambalaya,assets/img/94.jpg,Prawn jambalaya,"This nourishing jambalaya is a winning recipe. It's low-fat, low-calorie, and provides 4 of your 5-a-day - plus it's all made in one pan so less washing up!","['1 tbsp rapeseed oil', '1 onion, chopped', '3 celery sticks, sliced ', '100g wholegrain basmati rice', '1 tsp mild chilli powder', '1 tbsp ground coriander', '½ tsp fennel seeds', '400g can chopped tomatoes', '1 tsp vegetable bouillon powder', '1 yellow pepper, roughly chopped', '2 garlic cloves, chopped', '1 tbsp fresh thyme leaves', '150g pack small prawns, thawed if frozen', '3 tbsp chopped parsley']","['Heat the oil in a large, deep frying pan. Add the onion and celery, and fry for 5 mins to soften. Add the rice and spices, and pour in the tomatoes with just under 1 can of water. Stir in the bouillon powder, pepper, garlic and thyme.', 'Cover the pan with a lid and simmer for 30 mins until the rice is tender and almost all the liquid has been absorbed. Stir in the prawns and parsley, cook briefly to heat through, then serve.']","{'kcal': 396.0, 'fat': 8.0, 'saturates': 1.0, 'carbs': 55.0, 'sugars': 15.0, 'fibre': 9.0, 'protein': 20.0, 'salt': 1.3}",45
Dinner recipes,One pot recipes,https://www.bbcgoodfood.com/recipes/one-pan-smoky-beans-sausage-meatballs,assets/img/95.jpg,One-pan smoky beans & sausage meatballs,"Cook our smoky beans and sausage meatballs dish in one pan – it's ideal camping food. This recipe mostly uses storecupboard ingredients, and is easily scaled up, too","['6 pork sausages', '2 tbsp sunflower oil', '1 onion, finely chopped', '2 garlic cloves, finely chopped', '2tbsp fajita spice mix (see tip, below)', '1 tbsp vinegar (any you have)', '400g chopped tomatoes or passata', '2  x 400g cans cannellini beans, drained (or any other canned beans you have)', 'handful of coriander or parsley, roughly chopped (optional) crusty bread or jacket potatoes, to serve (optional)']","['Squeeze the sausagemeat from one of the sausages, then roll into four balls. Repeat with the rest of the sausages. Heat half the oil in a flameproof casserole, shallow saucepan or deep frying pan over a medium heat and fry the sausage balls for about 8 mins, stirring occasionally until browned all over.', 'Scatter in the onion, drizzle in the remaining oil and cook for 5 mins until the onions are golden. Add the garlic and cook for 2 mins more. Scatter in 1 tbsp sugar and the fajita spice mix, cooking for a minute or two until the mixture has thickened. Splash in the vinegar, tip in the tomatoes and a can of water, then add the beans. Season, stir, bring to a simmer and bubble gently for 15-20 mins until the sauce is thick and rich. Remove from the heat and leave to cool slightly. Can be prepared up to three days ahead, then cooled completely and chilled for up to three days or frozen for three months. Defrost completely in the fridge overnight and reheat in a pan until piping hot. Scatter with parsley or coriander and serve with crusty bread or jacket potatoes, if you like.']","{'kcal': 395.0, 'fat': 18.0, 'saturates': 6.0, 'carbs': 34.0, 'sugars': 9.0, 'fibre': 11.0, 'protein': 19.0, 'salt': 1.9}",55
Dinner recipes,One pot recipes,https://www.bbcgoodfood.com/recipes/chipotle-bean-chilli-baked-eggs,assets/img/96.jpg,Chipotle bean chilli with baked eggs,"Black beans make a great foundation for this storecupboard, Mexican one-pot with smoky hot sauce, coriander and tortillas","['1 tbsp sunflower oil', '1 onion, chopped', '1-2 tbsp chipotle paste (depending on how hot you like it)', '2 x 400g cans  black beans, drained and rinsed', '400g can mixed bean, drained and rinsed', '2 x 400g cans chopped tomatoes with garlic & herbs', '1 heaped tbsp brown sugar', '4 eggs', 'small handful coriander leaves', 'soured cream, to serve', 'warm  flour tortillas, to serve']","['Heat the oil in a deep frying pan and cook the onion for about 5 mins until soft. Add the chipotle paste, beans, tomatoes and sugar, and simmer for about 15-20 mins until thickened. Season to taste.', 'Make 4 holes and crack an egg into each one. Cover and simmer over a low heat for 8-10 mins until the eggs are cooked to your liking. Sprinkle with coriander leaves and serve with a bowl of soured cream and some warm flour tortillas.']","{'kcal': 377.0, 'fat': 10.0, 'saturates': 2.0, 'carbs': 48.0, 'sugars': 21.0, 'fibre': 15.0, 'protein': 24.0, 'salt': 0.5}",35
Dinner recipes,One pot recipes,https://www.bbcgoodfood.com/recipes/saucy-bean-baked-eggs,assets/img/97.jpg,Saucy bean baked eggs,"Make these five-ingredient baked eggs with tomatoes and beans using storecupboard staples. It's a quick, easy, tasty and healthy dish","['2 x 400g cans  cherry tomatoes', '400g can mixed bean salad, drained', '200g baby spinach', '4 medium eggs', '50g thinly sliced smoked ham, torn', 'wholemeal rye bread, to serve (optional)']","['Tip the tomatoes and bean salad into an ovenproof frying pan or shallow flameproof casserole dish. Simmer for 10 mins, or until reduced. Stir in the spinach and cook for 5 mins more until wilted. ', 'Heat the grill to medium. Make four indentations in the mixture using the back of a spoon, then crack one egg in each. Nestle the ham in the mixture, then grill for 4-5 mins, or until the whites are set and the yolks runny. Serve with rye bread, if you like.']","{'kcal': 366.0, 'fat': 12.0, 'saturates': 3.0, 'carbs': 27.0, 'sugars': 15.0, 'fibre': 10.0, 'protein': 32.0, 'salt': 1.0}",25
Dinner recipes,One pot recipes,https://www.bbcgoodfood.com/recipes/one-pan-coconut-dhal,assets/img/98.jpg,One-pan coconut dhal,"Rustle up a versatile coconut dhal. It’s the most comforting vegan meal, all made in one pan, and it can also be used as a base to make other curries.","['300g red lentils', '2 tbsp sunflower oil, plus extra for drizzling', '2 onions, finely sliced', '4 garlic cloves, crushed or finely chopped', 'thumb-sized piece of ginger, finely chopped', '5 curry leaves (optional)', '1 tsp mustard seeds', '1 tsp  cumin seeds', '1 tsp coriander powder', '1 tsp turmeric', '1 dried red chilli, left whole', '1 tbsp tomato purée', '400g can coconut milk', 'coriander leaves, sliced ginger and sliced green chilli, to serve']","['Rinse the lentils until the water runs clear, then drain. Heat the oil in a large, shallow pan and cook the onions over a low heat for 10 mins until starting to brown, adding more oil if the pan looks dry. Add the garlic and ginger, and cook for another 30 seconds. Scatter in the curry leaves, if using, and all the spices and cook for a few minutes more, then stir in the tomato purée and cook for a minute longer.', 'Stir in the lentils, ensuring they’re well coated in the spices, then pour over the coconut milk and 850ml water. Bring to the boil, stirring occasionally, then simmer for about 30 mins until the lentils are soft and soupy. Scoop out the whole chilli and discard, then season generously with salt. The dhal can now be left to cool, then frozen in portions, or as one batch in a large plastic container. Defrost completely before reheating in a pan over a low heat, adding more water to loosen if needed.', 'Serve with a sprinkling of the coriander, sliced ginger and chilli, and drizzle with a bit more oil.']","{'kcal': 531.0, 'fat': 24.0, 'saturates': 15.0, 'carbs': 51.0, 'sugars': 8.0, 'fibre': 10.0, 'protein': 22.0, 'salt': 0.1}",55
Dinner recipes,One pot recipes,https://www.bbcgoodfood.com/recipes/mushroom-rice-one-pot,assets/img/99.jpg,Mushroom & rice one-pot,"Transform a handful of simple storecupboard ingredients into this hearty, comforting supper","['200g basmati rice', '1 tbsp olive oil', '1 large onion, chopped', '2 tsp chopped rosemary or 1 tsp dried', '250g chestnut mushroom, quartered', '2 red peppers, sliced', '400g can chopped tomato', '425ml vegetable stock', 'handful parsley, chopped']","['Heat oven to 190C/fan 170C/gas 5. Tip the rice into a sieve, rinse under cold running water, then leave to drain. Heat the oil in a flameproof casserole, add the onion, then fry until softened, about 5 mins. Stir in the rosemary and mushrooms, then fry briefly. Add the rice, stir to coat in the oil, then add the peppers, tomatoes, stock and some freshly ground pepper. Bring to the boil, give it a stir, cover tightly with a lid, then bake for 20-25 mins until the rice is tender. Scatter over the parsley and serve.']","{'kcal': 282.0, 'fat': 5.0, 'saturates': 1.0, 'carbs': 55.0, 'sugars': 7.0, 'fibre': 4.0, 'protein': 9.0, 'salt': 0.36}",50
